539748837061,356060330,颜色分类:102浅灰;尺码:160/80A/S,乐***9,291597653358,12号拍下的，昨天就收到了，真的是神速，并且快递小哥晚上加班给送到家的，真心负责！这件大衣满足了我对呢大衣的所以幻想，哈哈，大翻领，腰带，长款，加侧兜，大口袋是亮点！就是腰带赶紧像是有人试过，有轻微的想起球，希望穿起来衣服不会起球吧，满意！,2016-11-14 08:38:35,4,1
539748837061,356060330,颜色分类:162深牛仔蓝;尺码:160/80A/S,l***9,296448372831,一大早就收到了，顺丰真的很快，衣服很有质感，前面还纠结选什么颜色，深蓝色拿到手，瞬间觉得自己选对了，还有就是衣服真的很长，我164，53公斤，选s码到小腿肚。穿上特别酷，酷的我都不好意思穿单位了哈哈，暂时就这么多啦后续在评价,2016-12-21 20:33:16,0,2
539748837061,356060330,颜色分类:162深牛仔蓝;尺码:160/80A/S,a***程,293854360510,虽然拿过来有点皱我拿去洗衣店熨了，质量没话说，和店里一样，哈哈哈，我觉得我开始应该再买小一号，我168，49公斤，买了s有点大，不过冬天还好，哈哈哈，嗯，很帅气，大方得体，但是又没有那么单调，因为领子有一圈红色的边，总之很喜欢，不夸了，上图。,2016-11-30 10:07:41,0,5
539748837061,356060330,颜色分类:162深牛仔蓝;尺码:170/88A/L,t***1,294413693167,款式很大气。版型很大，之前买的灰色大了，换的小点的蓝色，蓝色的这件应该是别人试过的，腰带都不是全新了，不过很大气，留下啦。身高170。能驾驭。坐等双十一送的包包，哈哈，包包到了再来追评，,2016-12-02 18:35:25,4,2
539748837061,356060330,颜色分类:162深牛仔蓝;尺码:160/80A/S,泓***n,291410885261,款式很大牌，漂亮，能穿出气质，很合心意，觉得这个价挺值的。衣服是宽松版，已经有预见的买小一号，还很宽松，主要我骨架小了，撑起这衣服勉强(需借助高跟鞋)。挺适合骨架大，高而瘦的人穿，有欧美风范。衣服厚重，坠性好，包装盒大，衣服没有被压绉。后面穿着看，穿一段时间不起球才是真的好。,2016-11-12 22:46:33,3,2
539748837061,356060330,颜色分类:102浅灰;尺码:175/92A/XL,你***渝,299927696044,大牌剪裁就是好，料子不错，妈妈穿上很好看，价格也不是太贵，好评,2017-01-20 13:42:30,0,2
539748837061,356060330,颜色分类:102浅灰;尺码:160/80A/S,w***0,297267479514,其实Xs一点也不小，这款确实休闲修身两相宜啊！袖子是宽松款给内搭流了不少空间啊！喜欢！虽然中间换了一次货，但总算如愿啦！,2016-12-28 21:05:39,0,2
539748837061,356060330,颜色分类:162深牛仔蓝;尺码:165/84A/M,购***肖,297385489138,很喜欢，在店里试了好几次，最后还是淘宝便宜，做活动买下，划算很多。跟店里质量感觉是一样的。因为一个小误会我相信是正品，收到货后发现腰带两边脱线，有三处开口，跟客服联系，在我已经下了吊牌的情况下依旧同意换货，其实我已经考虑要不要退货了，刚好当天平安夜我人在商场，于是跑到店里去看有没有活动。结果发现这款衣服全部两边开线，一问之下才知道原来这是荷包。就这点看来，网上和店铺里都是一样的，而且客服都不知道，那么我相信是正品，因为如果是造假，那么这么刻意的模仿客服肯定知道怎么回复的啊，不会开口直接同意售后的。客服态度都很好，不过想要联系上客服真难啊&hellip;&hellip;&hellip;,2016-12-29 21:51:38,4,0
539748837061,356060330,颜色分类:162深牛仔蓝;尺码:160/80A/S,淡***q,299490331038,恩，穿出去挺保暖的，也没有发现瑕疵。165，55，买的s，感觉还是大，但是看尺码表数据，xs也不一定很小多少，于是木有退。很开心的穿,2017-01-17 16:51:19,0,2
539748837061,356060330,颜色分类:102浅灰;尺码:160/80A/S,格***7,299551004970,"实体店看的，当时没买，在网上搜了买的，价钱差不多，当时在实体店试的就是S码，结果网店客服给我推荐M,还好我没听客服的，坚持买了s码，很合适，特别喜欢，我身高174体重58公斤。特别说一句，个人认为这个款只适合身高168以上的妹子，娇小型妹子就不要尝试了，因为真的很长，我妈165穿起来像那种长睡袍！！",2017-01-16 21:54:12,0,0
539748837061,356060330,颜色分类:102浅灰;尺码:165/84A/M,夏***光,296269584103,从我们当地店里寄过来的，比较快，衣服比较可以，但提醒大家买小一点，本人170，114，买中号大了一点，本来喜欢穿宽松的，大一个号肩膀撑不起来，而且，盆骨那个位置也会看上去很大，总体来说还行，一直买only的衣服，质量好品质好，大衣我喜欢买only.皮草moda做的更好一点，希望给你们参考。,2016-12-18 11:40:28,2,0
539748837061,356060330,颜色分类:102浅灰;尺码:160/80A/S,曹***1,291961497619,双十一零点后的30秒入手的！心情那个激动啊！因为之前在实体店试过就非常喜欢！实体店不打折也没舍得买。巧了，赶上时候了好开心。第二天就到了。质量和实体店一样！棒棒哒！在店里拍的图。借用到这。码数偏大很多。170身高穿S码也稍宽松,2016-11-14 23:12:12,2,1
539748837061,356060330,颜色分类:102浅灰;尺码:165/84A/M,弈***弈,297908242624,非常喜欢，这款上是在实体店试过的，当时觉得好贵，犹豫了一下，随后就看到官方旗舰店折扣这么大出，瞬间收了一件，后面又买了好几件，都很满意，绝对好评，这款感觉尺码略大，170.57，穿165的很宽松,2017-01-05 09:54:09,3,0
539748837061,356060330,颜色分类:102浅灰;尺码:155/76A/XS,小***0,296518386063,真实身高158多一点吧可能，买的xs，心惊胆战的，惊喜的是穿上很好看，非常喜欢，配个高跟小马靴，阔腿裤，完美了。让我惊呆了的是这个上衣为嘛只有一个口袋&hellip;&hellip;额&hellip;&hellip;居然没有人问这个问题&hellip;&hellip;好吧&hellip;&hellip;这个天气南京最高温11度，棉毛衫加不太厚的线衣再加它就够了，再冷点可以把棉毛衫换成加绒的，超级挡风。活动价很便宜，开心,2016-12-22 17:21:07,3,0
539748837061,356060330,颜色分类:162深牛仔蓝;尺码:170/88A/L,李***8,291345516737,国庆在实体试过的，1700，没舍得，果然被我等到了，气场很足，款式较长，，我身高170穿着快到脚踝，款式很好，实物比照片好看,2016-11-13 15:17:55,3,2
539748837061,356060330,颜色分类:162深牛仔蓝;尺码:160/80A/S,王***3,297338604830,快递超级快，很开心，衣服很喜欢，172，51，买的s号，挺合适的，蓝色是我喜欢的，衣服也很暖和，等着过年穿！,2016-12-28 11:06:17,3,2
539748837061,356060330,颜色分类:102浅灰;尺码:160/80A/S,w***4,297496794782,在商场试过了来买的，看起来质感很好，大衣很显高档，颜色也很好看哦，最重要的是活动价比商场活动价便宜了三百多，很满意！,2016-12-30 20:53:28,3,0
539748837061,356060330,颜色分类:102浅灰;尺码:155/76A/XS,a***e,297667096079,喜欢 用料很好 版型很好看 收腰后很显瘦。我想说 那些说衣服破个口子的妹纸们 那是侧口袋好么？自己拆开就行了 衣服做工已经很细致了 这个价格买到真是赚,2017-01-02 10:23:21,4,0
539748837061,356060330,颜色分类:102浅灰;尺码:155/76A/XS,e***乐,298876112113,大，161cm，54kg，穿的155，喜欢，大大的，崴了下脚，衣角就进水沟了，还是喜欢，穿运动鞋，很有范。重。为啥个子矮不能穿呢，喜欢,2017-01-11 16:14:26,3,0
539748837061,356060330,颜色分类:162深牛仔蓝;尺码:165/84A/M,b***子,296637091075,快递很快，本来想说发顺丰第二天就到没成想中通也这么快。衣服很漂亮，颜色无色差，一定要先熨烫！！！一定要！！！我165，62KG买的M大了，但也能撑起来，我也挺喜欢这种宽松的风格。反正很好看！,2016-12-25 10:02:21,2,0
539748837061,356060330,颜色分类:162深牛仔蓝;尺码:160/80A/S,t***2,298930186748,满意  实体店试过m太大  买的s还好有一点点大  不过再小的话可能不太好走路  因为比较长  下面会窄吧  可以穿厚毛衣  167  50,2017-01-13 10:00:18,0,0
539748837061,356060330,颜色分类:102浅灰;尺码:160/80A/S,曹***彦,296947890537,很好看、质感很好、穿的很美、开心、衣服两侧没完全缝起来的不是质量不好、是两边有两个暗口袋、剪开就是口袋啦、看到之前评价有说没缝好、其实就是口袋啦,2016-12-27 09:30:34,3,0
539748837061,356060330,颜色分类:162深牛仔蓝;尺码:155/76A/XS,淘***2,296073087982,衣服超级大气好看，就是有点瑕疵，开了一点线，但不影响我的心情，很喜欢，不愧是大牌，而且很合适打折,2016-12-19 19:34:50,3,0
539748837061,356060330,颜色分类:102浅灰;尺码:160/80A/S,叫***嘛,291543941563,only大牌真的发货超快！一分价钱一分货，料子真的好，版型也是那种偏欧美的。小个子女生不建议选择，165左右的s号就可以了，因为这个版型本来就偏大。好的是我喜欢的style,2016-11-14 10:54:28,0,0
539748837061,356060330,颜色分类:162深牛仔蓝;尺码:170/88A/L,木***约,298682187665,期待已久的大衣终于收到啦！面料很舒服，含毛量高，本人170高，比较胖130斤，L号很合适。十分满意！,2017-01-11 22:26:19,0,0
539748837061,356060330,颜色分类:102浅灰;尺码:155/76A/XS,潇***2,298649851493,特意拍小了一码，挺合身的，很喜欢这款式，简单大气！中间出了点问题，也得到了解决，客服处理问题态度挺好，不愧是旗舰店，下次还会光顾！,2017-01-11 18:00:41,0,0
539748837061,356060330,颜色分类:102浅灰;尺码:160/80A/S,t***0,298072364865,第N次购买了，款式正是我想要的，大小合适。好评！尤其感谢快递，因为星期天，竟然可以将宝贝直接送到我家！太感动了！必须好评！,2017-01-03 17:33:44,4,0
539748837061,356060330,颜色分类:162深牛仔蓝;尺码:175/92A/XL,飞***间,297452634797,特别好的大衣，很有型，非常喜欢，比专柜正价便宜了很多，个人觉得很划算。如果之后穿了不起球就更棒了！,2016-12-30 14:44:23,0,0
539748837061,356060330,颜色分类:102浅灰;尺码:160/80A/S,v***9,296690969128,嗯，衣服很长，165大概接近脚踝的位置，也挺厚实，料子很沉，穿着很有范，only老顾客了，基本每次都很满意~,2016-12-24 21:46:20,0,0
539748837061,356060330,颜色分类:162深牛仔蓝;尺码:170/88A/L,m***1,291599180492,"比我想象中的厚多了，又很长，我觉得跟北京都能过冬了，是欧洲很流行的款式，是oversize的，我165,118斤穿L的很大，喜欢的可以买小一码，但是我喜欢大一点的，穿着比较随意有气质",2016-11-15 10:25:54,4,0
539748837061,356060330,颜色分类:162深牛仔蓝;尺码:160/80A/S,漠***玥,297429256686,好评！衣服质量超好，款式新颖美观，上身效果非常好！收到后很惊喜！之前拍大了一码，又重新拍了小一码的，客服非常耐心周到，非常赞！！！！！,2016-12-31 17:23:14,0,0
539748837061,356060330,颜色分类:162深牛仔蓝;尺码:165/84A/M,7***y,298068889464,太好看了，穿上大气，大小长短正好，穿上很大牌大牌的衣服,2017-01-07 10:30:32,0,0
539748837061,356060330,颜色分类:102浅灰;尺码:170/88A/L,芳***幽,291775086001,昨天晚上拍的，今天就到了，拍的号很合适，款式做工都很棒，有大牌范儿，包装很高大上，取出衣服不用烫就直接能穿。,2016-11-14 20:32:42,3,0
539748837061,356060330,颜色分类:102浅灰;尺码:165/84A/M,l***1,296022076615,衣服和店里看到的一摸一样，质量也很棒，买的时候比店里还便宜80，一定给工作人员点个赞，效率非常高，包括快递员，头天下午下单，第二天中午就收到了，?,2016-12-19 12:27:04,2,0
539748837061,356060330,颜色分类:162深牛仔蓝;尺码:170/88A/L,钟***羽,299561321891,衣服很棒，大气又精致，暗红色压边很漂亮。很满意,2017-01-17 09:12:19,0,0
539748837061,356060330,颜色分类:162深牛仔蓝;尺码:160/80A/S,雨***珑,299918975459,超级满意，在实体店试了，但没有小码，所以来这里买，快递包装都特别好，客服回复很快，非常开心的一次购物～,2017-01-24 10:45:53,2,0
539748837061,356060330,颜色分类:162深牛仔蓝;尺码:160/80A/S,l***1,295983147481,物流神速 在only和vm家挑好久才锁定了这款 高大上 拿回家 很惊喜 衣服很厚实 提在手里很有分量 推荐,2016-12-18 00:36:21,3,0
539748837061,356060330,颜色分类:102浅灰;尺码:170/88A/L,泡***尚,296274057346,物流快，包装好，不错，本来以为号小了，结果还稍微大一点，建议比平常号小一号，这是宽松款的，总之很满意,2016-12-20 23:34:09,2,0
539748837061,356060330,颜色分类:102浅灰;尺码:175/92A/XL,张***4,296598664191,超美，专卖店试完才买的。一样一样的 身高一米七八 xl快到脚踝非常大气有范。而且快递也很给力。这么便宜买也是超值。而且比五折更低呢,2016-12-22 21:19:18,2,0
539748837061,356060330,颜色分类:102浅灰;尺码:165/84A/M,曾***倩,296830779074,料子很好，也很厚实，就是感觉版型有点成熟，直筒型，如果是下摆大一点的版型，感觉会更好看,2016-12-24 21:02:57,3,0
539748837061,356060330,颜色分类:162深牛仔蓝;尺码:160/80A/S,宝***3,297713589875,我觉得还是很好看的，也没有像评论那样说是试过的，质量也很好，挺厚实的，穿上很显瘦，很喜欢,2017-01-03 13:10:53,0,0
539748837061,356060330,颜色分类:102浅灰;尺码:165/84A/M,t***8,293710085928,适度相当快，我165穿上快到脚脖子了，有点宽松挺有范的,2016-11-29 19:02:22,4,0
539748837061,356060330,颜色分类:102浅灰;尺码:160/80A/S,x***n,296148501165,下午订的，第二天早上就到了，速度好快，质量很好，也很长，怀孕了，开始怕小号穿不得，完全不用担心，宽松版的，很有型。,2016-12-19 07:41:59,2,0
539748837061,356060330,颜色分类:102浅灰;尺码:160/80A/S,爱***9,296676276553,衣服超级美，质感好，棒棒哒?,2016-12-23 13:53:00,3,0
539748837061,356060330,颜色分类:162深牛仔蓝;尺码:165/84A/M,w***8,299690013196,"喜欢修身的建议买小一码。我166,58kg，开始买的165码，太大，换了160码合适多了。客服服务好，换货迅速。",2017-01-18 09:03:04,3,0
539748837061,356060330,颜色分类:162深牛仔蓝;尺码:160/80A/S,梧***心,291993460088,一直喜欢only，大衣面料精良，款式经典又不老气，很满意！,2016-11-15 19:34:21,3,0
539748837061,356060330,颜色分类:102浅灰;尺码:160/80A/S,纯***情,299424890973,漂亮，大气，物有所值，和专柜的一模一样，很有感觉，超喜欢。,2017-01-17 10:49:56,0,0
539748837061,356060330,颜色分类:162深牛仔蓝;尺码:155/76A/XS,t***1,297786544060,衣服收到很喜欢，客服&ldquo;琳达&rdquo;很尽职，售后也非常好，换了地址也帮忙改了，非常感谢,2017-01-01 10:24:53,3,0
539748837061,356060330,颜色分类:162深牛仔蓝;尺码:165/84A/M,机***1,291572888326,双十一发货依然这么速度，对店家也是非常佩服~顺丰物流也很是给力12号就到了，大盒子包装，很是高大上，衣服熨的也很平整，穿起来很大气，长长的盖住腿很暖和，很满意 ~,2016-11-13 21:27:41,2,0
539748837061,356060330,颜色分类:162深牛仔蓝;尺码:170/88A/L,s***j,291684957464,一看是咱们盐城当地发货，以为一定不是真货，结果到手一看二掂三细究，真品好质好版形，欧洲版，适合我这样的高个长手长脚身材穿！大爱！,2016-11-13 14:48:06,4,0
539748837061,356060330,颜色分类:102浅灰;尺码:165/84A/M,伯***2,291238278311,太好看了。特意在实体店试了才买的。好像买大一码了。我高167 体重118在实体店s码的就够了。但是这个也还行。毕竟我也还有这么高嘛！哈哈?！好喜欢,2016-11-12 17:15:56,2,0
539748837061,356060330,颜色分类:162深牛仔蓝;尺码:165/84A/M,张***0,292897267528,不得不说商家太给力了，双晚上拍的，第二天一大早就收到了，真的有被惊讶到。非常好大上,2016-11-21 10:38:15,2,3
539748837061,356060330,颜色分类:102浅灰;尺码:165/84A/M,咩***a,296205893488,很喜欢，173，108，穿M码正好，穿起来很有范,2016-12-20 10:54:44,4,0
539748837061,356060330,颜色分类:102浅灰;尺码:160/80A/S,w***2,298965495991,相当不错！很值得推荐，么么哒。。。。。,2017-01-13 18:36:04,2,0
539748837061,356060330,颜色分类:102浅灰;尺码:165/84A/M,t***1,296872917357,质量很好，发货快，不起球，面料厚重,2016-12-25 22:26:44,3,0
539748837061,356060330,颜色分类:102浅灰;尺码:165/84A/M,冰***7,296455100988,喜欢，穿上大气上档次，颜色好！,2016-12-19 19:11:32,3,0
539748837061,356060330,颜色分类:102浅灰;尺码:175/92A/XL,戏***妆,293587274662,不错，样子特别好，版型也不错，双十一优惠卖的，很好，物流也很快！,2016-11-27 18:40:27,3,0
539748837061,356060330,颜色分类:102浅灰;尺码:160/80A/S,w***n,291816876219,发货超快，顺丰第二天就收到了。衣服很厚实，大小合适，样式好看，很喜欢??超出预期,2016-11-16 12:29:41,3,0
539748837061,356060330,颜色分类:102浅灰;尺码:170/88A/L,花***3,292027313836,啊啊啊啊！超喜欢！！买的L号，可能有些大，但我174的个子完全撑得起来，太有范了！手感舒适，质量也好，很满意。全五分，好评！,2016-11-17 08:35:13,2,0
539748837061,356060330,颜色分类:162深牛仔蓝;尺码:160/80A/S,t***2,291906145968,不知道为什么扣了我99积分 比实体店优惠太多了 顺丰很快 隔天就到了 衣服好大气 好喜欢 168 52 s码刚好,2016-11-16 08:42:45,4,0
539748837061,356060330,颜色分类:162深牛仔蓝;尺码:165/84A/M,t***7,295944892598,特别好，特别喜欢only的衣服，质量不用说，设计也特别大气，服务态度好，发货快，物流快，不合适退换货也特别痛快，不能更赞,2016-12-18 11:34:42,3,0
539748837061,356060330,颜色分类:102浅灰;尺码:175/92A/XL,萨***饺,292681056465,帅！适合高个妹子穿，我180到小腿下半截，真的很长。,2016-11-20 08:14:05,2,0
539748837061,356060330,颜色分类:102浅灰;尺码:160/80A/S,臭***6,299734967897,<b></b>此<b></b>用<b></b>户<b></b>没<b></b>有<b></b>填<b></b>写<b></b>评<b></b>论<b></b>!<b></b>,2017-01-16 11:22:26,0,0
539748837061,356060330,颜色分类:162深牛仔蓝;尺码:165/84A/M,陶***h,292609247870,速度真的是吓到我了，双十一上午买的，第二天就到了，质量跟商场的一样，肯定是正品，而且服务态度特别好，非常满意,2016-11-21 21:58:29,2,0
539748837061,356060330,颜色分类:102浅灰;尺码:160/80A/S,可***唐,291782724239,实体店试了蛮喜欢，原价没敢剁手，顺丰很优秀。穿上美美美,2016-11-14 19:25:22,3,0
539748837061,356060330,颜色分类:162深牛仔蓝;尺码:160/80A/S,凯***稚,291297183586,给女朋友买的，快递很给力，没有想到在双十一这个物流拥挤的时期，居然1天就到啦。。衣服女朋友很喜欢，很开心。与实体店同款，正品。,2016-11-12 13:32:34,0,0
539748837061,356060330,颜色分类:162深牛仔蓝;尺码:160/80A/S,默***9,293087238148,大衣收到了，很满意，和图片没有差别，客服推荐的号也合适，全五！,2016-11-25 13:16:36,2,0
539748837061,356060330,颜色分类:102浅灰;尺码:165/84A/M,y***l,291784221990,双十一快递相当给力！衣服质量很好，很有范儿，满意,2016-11-14 21:19:17,1,0
539748837061,356060330,颜色分类:102浅灰;尺码:175/92A/XL,t***2,293002822101,女儿很喜欢，也很喜欢only家衣服，还会继续光顾，好评,2016-11-24 17:49:29,3,0
539748837061,356060330,颜色分类:102浅灰;尺码:160/80A/S,p***6,293318300589,非常满意，上身效果非常好，很喜欢，很暖和,2016-11-27 09:45:19,0,0
539748837061,356060330,颜色分类:162深牛仔蓝;尺码:170/88A/L,s***3,291708155619,给家人买的，满意，版型很不错，够大气，喜欢。,2016-11-15 08:09:02,4,0
539748837061,356060330,颜色分类:102浅灰;尺码:175/92A/XL,d***媛,291694390292,哈哈，优惠的时候买的，比门店优惠很多，大爱！大气,2016-11-15 20:40:59,3,0
539748837061,356060330,颜色分类:162深牛仔蓝;尺码:175/92A/XL,m***h,291577757631,衣服很好 有重量 和图无差别 快递超快 版型好 发货之前 还熨了 谢谢,2016-11-12 20:23:11,3,0
539748837061,356060330,颜色分类:102浅灰;尺码:160/80A/S,a***9,296249018311,质量不错，手感舒适，不扎手，穿着大概就这样子，多拍了几张，给其他淘友参考吧。很长。双十二价格很划算。好评,2016-12-18 18:15:23,2,5
539748837061,356060330,颜色分类:102浅灰;尺码:155/76A/XS,会***求,295350100799,双十二拍的，今天就收到货了，衣服很满意，大小也正好，可惜发现后面有两道开线的地方，共四个部位，已经把这个情况告诉卖家了，但目前还没回音,2016-12-13 12:25:34,3,3
539748837061,356060330,颜色分类:102浅灰;尺码:165/84A/M,s***6,291582329649,太快了，双十一下单，做好了半个月才能收到的准备，结果第二天早上快递就到了，必须点赞！,2016-11-12 08:55:34,4,0
539748837061,356060330,颜色分类:102浅灰;尺码:160/80A/S,a***0,291734819479,起球情况：衣服非常好，满意，物流也超快，一次满意的购物。。,2016-11-13 14:20:44,2,0
539748837061,356060330,颜色分类:102浅灰;尺码:170/88A/L,雷***2,291693463295,快递真给力，衣服很不错。很厚实。客服推荐的码数也正好。,2016-11-13 18:54:25,3,0
539748837061,356060330,颜色分类:162深牛仔蓝;尺码:165/84A/M,l***9,296253755678,是软面料，重量挺足，深蓝色不亮，有点旧旧的，是让人接受的颜色，版型是宽松版，有点像今年的睡衣风，个高的人穿上很拉风，嗯，其他评论说侧边有开线，这个我很负责任的说一下：那是口袋那是口袋，不留孔隙你咋知道那里是口袋，这种留空不是很正常吗。不知道会不会起球啊， 之前来评论的亲也不回来追加了，到底起不起球啊,2016-12-20 10:16:36,3,0
539748837061,356060330,颜色分类:102浅灰;尺码:160/80A/S,q***i,295906344254,这次购物很不满意。和之前双11买的完全不一样。一看就是为了这次五折赶工出来的。布料比之前的差太多。整体偏轻。没垂感。没质感。上面竟然还有几根长白发。打折最多也就值五百多,2016-12-17 14:06:39,2,3
539748837061,356060330,颜色分类:102浅灰;尺码:160/80A/S,易***梅,296898979114,这件衣服可谓一波三折，双十一买了，结果大太多，平时170的，这个绝对160就可以了，然后就准备换货，结果问了5天的换货地址都没要到，要么不理，要么自动回复，要么什么确定吗？然后换客服重复回答，气炸了！退货！三十多邮费啊！好不容易等到双十二，比双十一时贵一百多，还是狠心买了，然后第二天就折扣季降价三百多！然后又不断联系客服！还好最终退了差价，皆大欢喜！再说说衣衣质量：整体面料很舒服，含有羊毛成分，但是那个口袋拆线没有锁边，一不小心拆过了...再者，那个扣子很容易就掉了，还有领子里面一排小扣子不知道是干嘛用的，难道本来有毛领被拆走啦？,2016-12-27 18:00:22,3,0
539748837061,356060330,颜色分类:162深牛仔蓝;尺码:160/80A/S,暗***7,297922858898,不能更帅气，尺码偏大，买小了一码还是大了，本来想等到有xs的时候换货，可惜没等到，s码也能穿，就留下了。毛呢偏重，但是质量很好，柔软不起球，168的个子穿到脚踝上方，除了侧面大口袋还有两个暗袋，把线拆了就能用啦,2017-01-03 16:54:50,0,0
539748837061,356060330,颜色分类:102浅灰;尺码:160/80A/S,一***一,300216736465,宝贝收到、看了一下、两边腰线有点开线不过还是蛮喜欢的、美中不足、毕竟是品牌希望以后能注意一下这些细节,2017-01-24 20:05:03,0,1
539748837061,356060330,颜色分类:102浅灰;尺码:155/76A/XS,c***n,292512763507,第一眼就喜欢这件大衣，简单大气，很不错！,2016-11-20 08:06:56,3,0
539748837061,356060330,颜色分类:162深牛仔蓝;尺码:155/76A/XS,j***7,293630510435,衣服是从县里的商场发来的，衣服上有长头发，还有其他毛衣沾的毛毛，腰带有磨损，侧兜也拆开了，我下订单时备注不要发顺风需要自取，最后还是发了顺风，希望可以改进，毕竟便宜的小牌厂家这些都做的很好，大牌更应该注重这些细节！衣服是宽松版的，160.穿高跟最小号才能驾驭,2016-11-28 18:26:38,3,0
539748837061,356060330,颜色分类:102浅灰;尺码:155/76A/XS,半***沧,297560652597,跟实体店试的一样，165，52，xs码，非常肥大，要把腰带系在后面束腰，系在前面特别丑。不过整体还是挺喜欢的。,2017-01-01 23:41:16,2,1
539748837061,356060330,颜色分类:162深牛仔蓝;尺码:170/88A/L,漫***空,291561741690,非常喜欢，面料很好穿上感觉好热。物流也很快。?????,2016-11-12 17:58:07,3,0
