539968351436,356060330,颜色分类:106花灰;尺码:160/80A/S,x***a,298681377646,收到货了。感觉很不错。发货快。物流包装的也好！适合个子高的人！很修身。我102斤穿160的略显大！家人都说不错。就不换了！全五分好评！,2017-01-11 21:19:38,0,4
539968351436,356060330,颜色分类:010黑/Black;尺码:165/84A/M,德***1,296282263897,在商场第一次看到的时候很喜欢，那时候要1499，第二次去还是被吸引了，穿着很优雅，很大气，款式很经典，在网上刚好看到打半折，就赶紧买了，很划算，奖励自己,2016-12-19 16:46:53,3,0
539968351436,356060330,颜色分类:04D深松石绿;尺码:165/84A/M,森***3,297565854684,很好 之前就在实体店试了 太贵了没舍得买 惊喜看到打折 实物很美 穿上很有气质 适合个子高的人,2017-01-01 12:59:07,0,1
539968351436,356060330,颜色分类:04D深松石绿;尺码:165/84A/M,w***8,296582363791,衣服很漂亮，黑色特显瘦，就是爱沾毛毛。留了墨绿色，挺有范儿的穿着，我165，穿M码到小腿肚那里。我个子要是能再高点就好了，呜呜&hellip;&hellip;很喜欢only家的衣服，以后会一直关注的。。。,2016-12-22 21:28:19,0,0
539968351436,356060330,颜色分类:106花灰;尺码:155/76A/XS,t***1,296172635687,大翻领很有气质，买了xs，长度到快到脚踝了，呢大衣感觉挺厚的，但这么长的款穿上也不觉得很沉，面料手感很好，扣子也很精致，虽然发货慢了些，快递还是很快的。,2016-12-19 15:37:47,3,0
539968351436,356060330,颜色分类:04D深松石绿;尺码:170/88A/L,刘***悦,297870869912,本来看上的不是这一件，阴差阳错买了这一件，结果超级爱呀，哈哈，我个子高，上身效果特别好。很有范儿，棒棒的。一直钟爱你家衣服,2017-01-04 14:18:31,3,0
539968351436,356060330,颜色分类:04D深松石绿;尺码:170/88A/L,d***1,298772421808,穿上挺美的，170高128重170的号正好，长款大衣穿上特别有范儿，好多人都说颜色特别款式好看。,2017-01-13 11:49:21,0,0
539968351436,356060330,颜色分类:072铁锈红;尺码:170/88A/L,荒***l,296170209213,超级好看啊真的！！！  而且穿上很舒服  衣服比想象得长但是还是吼吼看啊  163以下的姑娘不适合这一款哦  快递顺丰好评好评好评,2016-12-18 18:40:40,0,1
539968351436,356060330,颜色分类:106花灰;尺码:170/88A/L,落***儿,296402534980,不错，好显瘦啊～哈哈哈，穿着拖鞋试的～感觉好长的衣服，不过之前去实体店试过，很喜欢的两件，所以这次活动就都入手了，非常合适,2016-12-19 19:04:12,4,0
539968351436,356060330,颜色分类:010黑/Black;尺码:165/84A/M,迷***莅,291545800176,非常好，快递给力，双十一拍的，两天就到了，女人一定要拥有一件属于自己的纯黑长款大衣，爱的不得了，质量也超好，一点褶都没有！,2016-11-13 16:01:19,0,1
539968351436,356060330,颜色分类:072铁锈红;尺码:175/92A/XL,奈***1,296110175370,暂时还好，后续需要观察，但是扣子不紧，瞅着就要掉了，回家还的补补 天气不是很冷，现在穿正合适 服务一般，但是发的顺丰，非常满意,2016-12-19 10:18:36,3,0
539968351436,356060330,颜色分类:072铁锈红;尺码:165/84A/M,l***i,296621906047,很喜欢这件衣服，第一眼就相中了，但是没有打折，等的打折才买的。只是买后有点无措，就一直没有确认收货，因为不知道怎么搭配了，166的个子，而自己也穿不了高跟，但愿能够匹配这件大衣吧。,2016-12-23 17:51:22,3,0
539968351436,356060330,颜色分类:106花灰;尺码:165/84A/M,幸***馨,299502856084,不错的衣服，个性，穿起来效果好。很大气的感觉，衣服很长，都说穿起来很好看。,2017-01-18 14:16:14,0,0
539968351436,356060330,颜色分类:010黑/Black;尺码:170/88A/L,m***1,292953379411,在实体店看到的衣服，刚好赶上双十一活动，就迫不及待的在这里下手了，真的很棒，黑色永恒的经典色，好好搭衣服，这款衣服还显人瘦，真的值得拥有。,2016-11-21 16:50:48,4,0
539968351436,356060330,颜色分类:106花灰;尺码:170/88A/L,柏***r,298412080371,质量不错，款式很满意，穿在身上很有型，比想象中厚一点，完全满意，超出期待。,2017-01-06 23:38:55,4,0
539968351436,356060330,颜色分类:072铁锈红;尺码:160/80A/S,f***8,298052468830,大衣已经洗过啦！没有掉色，比较厚实，是我喜欢的，大气的风格。,2017-01-05 17:17:03,4,0
539968351436,356060330,颜色分类:010黑/Black;尺码:165/84A/M,牛***华,296307809209,材质、版型真的非常满意，就是人矮，衣服就长了，只能高跟高跟。能在M号里出款稍短的就完美了。今年在ONLY买的衣服基本都挺满意,2016-12-19 20:17:28,3,0
539968351436,356060330,颜色分类:010黑/Black;尺码:165/84A/M,l***8,298241892216,很长的大衣，穿起来快到脚跟了。但是穿起来很有范，显瘦。,2017-01-06 17:50:39,0,0
539968351436,356060330,颜色分类:106花灰;尺码:165/84A/M,芳***哒,296950948369,忠实的顾客群&hellip;在银川买了绿色，觉得太耀眼&hellip;就在网上买了灰色&hellip;棒棒哒&hellip;大气,2016-12-26 08:05:44,0,0
539968351436,356060330,颜色分类:106花灰;尺码:160/80A/S,d***g,296013007162,好喜欢的大衣。版型很好，大小刚好。关键衣服是新的，也很干净。不像实体店买东西，打折后衣服都破破的。网购还用卷。总之非常满意，必须好评。还有顺风太快了,2016-12-18 16:09:19,2,0
539968351436,356060330,颜色分类:010黑/Black;尺码:170/88A/L,y***5,296552510419,这个大衣太棒了 很长～显瘦，有气质 我身高168穿着，很合适,2016-12-22 20:43:05,0,0
539968351436,356060330,颜色分类:072铁锈红;尺码:155/76A/XS,珑***0,292208446786,有史以来最快的一次网购，特别是在双11期间，简直是神速，可惜货来了之后，天气就开始转热了，现在还没有办法穿，和在专卖店试的一样，便宜了共三百块呢，好评!,2016-11-18 01:19:25,3,0
539968351436,356060330,颜色分类:106花灰;尺码:175/92A/XL,美***1,296299663803,衣服质量还是那么好，好多年的老朋友了，还是很喜欢，大衣够长够范，一如既往的支持，超赞,2016-12-21 18:42:28,3,0
539968351436,356060330,颜色分类:04D深松石绿;尺码:160/80A/S,6***y,296465176515,款式质量都很好，上身很漂亮，s很合适，超级喜欢！,2016-12-21 18:59:26,4,0
539968351436,356060330,颜色分类:072铁锈红;尺码:165/84A/M,酱***梅,296786741515,真的超级喜欢，很不错的颜色，大领子是我最喜欢的地方收腰的地方很好看。,2016-12-25 20:40:34,0,0
539968351436,356060330,颜色分类:010黑/Black;尺码:165/84A/M,h***9,296529631538,质量很好，很棒，很厚重，穿上很显气质。客服很棒，耐心的解不厌其烦的回答我的问题。信任官方旗舰店。,2016-12-23 10:20:07,3,0
539968351436,356060330,颜色分类:010黑/Black;尺码:165/84A/M,在***泪,296049228690,很有范，我和同事一人一件，很长建议1米6以上的妹妹穿，提个建议顺丰的快递是快，但是里面连个手提袋都没有。,2016-12-19 15:39:46,0,0
539968351436,356060330,颜色分类:106花灰;尺码:170/88A/L,海***7,297383545710,衣服质量很好，发货快，人在外地，暂时没试穿，试穿后再追评，满意！全5分,2016-12-28 16:23:52,3,0
539968351436,356060330,颜色分类:04D深松石绿;尺码:170/88A/L,蓝***8,298622236660,很长，显身材，面料柔软，有点粘毛,2017-01-12 13:27:00,0,0
539968351436,356060330,颜色分类:04D深松石绿;尺码:165/84A/M,盛***谷,291473384119,<b></b>此<b></b>用<b></b>户<b></b>没<b></b>有<b></b>填<b></b>写<b></b>评<b></b>论<b></b>!<b></b>,2016-11-12 23:27:24,3,3
539968351436,356060330,颜色分类:106花灰;尺码:165/84A/M,t***6,296323589232,衣服质量很好，很厚重，也很长，打折的时候买的超划算,2016-12-20 19:58:46,2,0
539968351436,356060330,颜色分类:010黑/Black;尺码:175/92A/XL,w***1,289471637724,高端大气品质很好，款式很喜欢，休闲时尚，发货快，下次还会继续光顾！,2016-10-27 14:26:57,0,0
539968351436,356060330,颜色分类:010黑/Black;尺码:165/84A/M,y***i,296797291696,特别喜欢，很显瘦，有范。172，54，165很合适。,2016-12-25 15:55:51,3,0
539968351436,356060330,颜色分类:072铁锈红;尺码:170/88A/L,杨***5,296290785889,闺女很满意，合身。一如既往的支持！,2016-12-20 14:56:02,2,0
539968351436,356060330,颜色分类:010黑/Black;尺码:170/88A/L,t***0,293527219990,很好很不错 确实便宜了好多双11,2016-11-26 19:19:12,3,0
539968351436,356060330,颜色分类:010黑/Black;尺码:170/88A/L,4***t,293764944941,喜欢，值得拥有，还会光顾哦，谢谢店家，嗯好。,2016-11-28 19:21:47,0,0
539968351436,356060330,颜色分类:010黑/Black;尺码:165/84A/M,笑***0,291656008284,衣服是在专柜试好的，所以码字合适！是经典款，自己很喜欢！?发货的速度很快！,2016-11-14 18:26:19,4,0
539968351436,356060330,颜色分类:010黑/Black;尺码:155/76A/XS,x***痴,297519109769,好起球哦，还很粘毛，除了版型好看。质量真的不值它这个价&hellip;,2017-01-01 08:35:36,3,1
539968351436,356060330,颜色分类:010黑/Black;尺码:165/84A/M,2***天,297203128423,做工：怎么说呢，有点失望，之前在商场试过这件，本来以为质量不会那么差的，但是收到的衣服袖口处起得都是球，而且领子那儿还有头发，如果是正品的话也是商场里试穿的衣服，因为款式是本人喜欢的，所以纠结了很长时间要不要退货，后来因为出差就没退这件，总之活动价的衣服还是要谨慎的。,2016-12-29 10:17:06,3,0
539968351436,356060330,颜色分类:04D深松石绿;尺码:165/84A/M,j***7,299817035071,黑美黑美的大衣，唯一的小遗憾就是左手口袋里面有点不规整，是扣子的原因。,2017-01-20 18:42:04,0,1
539968351436,356060330,颜色分类:010黑/Black;尺码:160/80A/S,啦***草,296605800145,版型不错但是超级长。。净身高163吧，穿着到小腿肚了，感觉抬脚幅度大了都会踢到，而且衣服特别黏毛啊。。我的硅胶杯子上粘的满满的。。不喜欢，感觉自己hold不住，然而剪了吊牌。。只穿出去过一会，720包邮转手有人要么？,2016-12-22 22:34:49,4,0
539968351436,356060330,颜色分类:010黑/Black;尺码:160/80A/S,江***逸,296747338457,穿上很好看哦，就是看起来像是有人试过一样，肩部有些起球了哦,2016-12-23 12:59:33,4,1
539968351436,356060330,颜色分类:010黑/Black;尺码:165/84A/M,t***4,298354627247,衣服样子不错，嗯，身高170穿长短正好，再长那么走路就不得劲了，面料不太好有点起球的赶脚,2017-01-06 13:07:04,3,0
539968351436,356060330,颜色分类:010黑/Black;尺码:155/76A/XS,苏***药,298932242480,其实我是想退的，版型不错，从专柜发的货，所以是正品，但是衣服起球，粘毛，也是真的，我的衣服一看就是被很多人试过了,2017-01-14 11:29:34,2,0
539968351436,356060330,颜色分类:04D深松石绿;尺码:160/80A/S,q***7,299292813588,才穿了两次扣子就掉了两颗 问售后能不能补发居然还说连一颗后备扣子都没有 太失望了 没想到第一次买only的衣服有这么差的体会 重点是这种扣在外面根本找不到 不会再来买了,2017-01-15 13:39:19,0,0
539968351436,356060330,颜色分类:010黑/Black;尺码:160/80A/S,h***0,296678720423,本来在店里试好了才买的，收到货感觉有点儿不太一样，袖口的里衬总是往外跑，而且商标不清楚，估计是高仿的&hellip;忙了几天几今天才有时间评论，算了，勉强穿吧，但是想买正品的慎购哦,2016-12-22 13:01:58,3,0
539968351436,356060330,颜色分类:04D深松石绿;尺码:165/84A/M,肖***浅,297702939825,衣服好看，很大气，有女身范，也很保暖，喜欢，价格比较优惠。,2017-01-03 08:32:31,2,2
539968351436,356060330,颜色分类:010黑/Black;尺码:165/84A/M,吴***妍,297919670901,面料厚实，就是太招毛，而且发过来就好多白毛毛，老妈看中了给她了,2017-01-02 19:14:23,3,0
539968351436,356060330,颜色分类:010黑/Black;尺码:160/80A/S,q***8,297818037461,质量真心不值原价，幸好打折买的，心里平衡了点，穿了一天就起球的不行，而且给我寄的盒子竟然是别家牌子的，客服也爱答不理的，真心无语，嫌麻烦就没退了,2017-01-04 08:11:51,2,0
539968351436,356060330,颜色分类:010黑/Black;尺码:160/80A/S,海***品,299623908466,质量还行，应该是正品，衣服很沉，超级长我165穿着感觉要拖地了，挺修身的，超级爱粘毛，还没有穿刚回来就沾了一身的毛毛,2017-01-18 19:42:15,0,0
539968351436,356060330,颜色分类:010黑/Black;尺码:170/88A/L,z***7,296346521933,我是典型纺锤形身材，腰上小肚子臀部都比较肉多，但是这款大衣穿上不但显瘦，而且腰部还有富裕，身高162，体重140，穿170的码肩部腰部都很合适，袖子略长,2016-12-18 22:30:22,3,0
539968351436,356060330,颜色分类:010黑/Black;尺码:170/88A/L,董***8,298822011079,很显瘦，捎长一点，穿上高跟鞋就好多了，太漂亮了,2017-01-12 11:52:48,3,3
539968351436,356060330,颜色分类:04D深松石绿;尺码:155/76A/XS,e***0,296329670347,第一次拍的时候从天津绫致仓发过来件穿过的，磨损很厉害，后来退了，换了账号重新拍，从商场调得货，这件就非常好。,2016-12-22 08:27:05,3,0
539968351436,356060330,颜色分类:106花灰;尺码:160/80A/S,流***雪,297130874412,衣服整体还行，就是穿出来感觉略显臃肿，而且来的时候扣子掉了一个，客服退了5块钱，不过感觉厚度可以，零度穿也行,2016-12-27 11:21:34,3,0
539968351436,356060330,颜色分类:04D深松石绿;尺码:165/84A/M,舍***8,299989512554,样式挺好的，有点起球，,2017-01-23 15:35:46,0,1
539968351436,356060330,颜色分类:106花灰;尺码:165/84A/M,4***龙,298155749499,很好 长款的 很厚实的感觉 比其它品牌实体店你的薄薄一层像风衣一样的大衣好多了 现在爱上捡漏和打折了,2017-01-07 15:00:06,3,0
539968351436,356060330,颜色分类:106花灰;尺码:170/88A/L,梦***调,297205260260,衣服质量不错，就是衣领稍微大了一点点,2016-12-29 22:23:51,0,1
539968351436,356060330,颜色分类:106花灰;尺码:170/88A/L,t***1,293406849951,这是我双11期间收到的第一个包裹，物流十分快，早上拍的，下午就已经到了。和实体店的一样，很有气质，很漂亮，之前在实体店试的165的，觉得如果穿多了就有点儿瘦，所以买大了一码，反而觉得不太像自己的衣服了，建议还是买修身正好的,2016-11-26 22:58:44,2,0
539968351436,356060330,颜色分类:072铁锈红;尺码:165/84A/M,s***1,299945929162,<b></b>此<b></b>用<b></b>户<b></b>没<b></b>有<b></b>填<b></b>写<b></b>评<b></b>论<b></b>!<b></b>,2017-01-08 08:17:17,0,0
539968351436,356060330,颜色分类:106花灰;尺码:160/80A/S,大***裙,298518682376,酒红色上身效果不错，但是特别粘绒，所以换了一件灰色，上身效果同样非常不错，符合我走路带风的需求，165/92S码到脚踝，今年最满意的大衣,2017-01-08 20:43:43,0,0
539968351436,356060330,颜色分类:04D深松石绿;尺码:165/84A/M,g***i,297809615131,从商场专卖店，发出来的货，东西绝对正，就是不知道是不是出样的，腰带比较皱。,2017-01-03 20:17:31,2,2
539968351436,356060330,颜色分类:010黑/Black;尺码:160/80A/S,陈***3,296121408587,<b></b>此<b></b>用<b></b>户<b></b>没<b></b>有<b></b>填<b></b>写<b></b>评<b></b>论<b></b>!<b></b>,2016-12-17 15:28:23,0,0
539968351436,356060330,颜色分类:072铁锈红;尺码:165/84A/M,小***7,298786318699,给妈妈买的，我在店里看过，妈妈说很粗糙，摸起来不怎么舒服。挺长的到小腿，总体还可以吧。,2017-01-12 18:22:15,0,0
539968351436,356060330,颜色分类:072铁锈红;尺码:165/84A/M,y***7,299771570070,一开始买大了一号，后来换小了一号，非常合适，料子非常好。很休身，显高显瘦。,2017-01-21 10:30:52,0,0
539968351436,356060330,颜色分类:072铁锈红;尺码:165/84A/M,贝***3,299638508877,<b></b>此<b></b>用<b></b>户<b></b>没<b></b>有<b></b>填<b></b>写<b></b>评<b></b>论<b></b>!<b></b>,2017-01-15 08:16:31,0,0
539968351436,356060330,颜色分类:010黑/Black;尺码:160/80A/S,t***子,298213579248,衣服长短还可以，就是有点粘毛，摩擦处过于现有起球状况，不过衣服很好看，实体店试过才购买的。而且衣服买了一两天就到货了，客服虽忙但是还算上心。不错值得买,2017-01-07 12:47:28,0,0
539968351436,356060330,颜色分类:04D深松石绿;尺码:165/84A/M,g***j,298463132054,做工：这件衣服做工很差，收到第一件看到胳膊那突出，换了一件，结果还是新衣服就好像有毛球的样子，看评论大家都是这样，就算了。这件衣服就胜在款式好了。不过682的大衣要求太多也不科学了。。,2017-01-10 15:53:50,3,0
539968351436,356060330,颜色分类:072铁锈红;尺码:155/76A/XS,樊***6,299371052455,衣服挺好看的，在店里试过，但是那件起球了，不想要，然后店员说天津总部也没有了，很奇怪，我居然还能在官网买到&hellip;&hellip;不过穿起来还是很好看&hellip;&hellip;,2017-01-18 14:20:42,0,0
539968351436,356060330,颜色分类:010黑/Black;尺码:165/84A/M,v***y,296624491107,第一张图是网上拍的，第二张是在实体店拍的，我感觉实体店的好像厚一些，不知道是不是我的错觉。,2016-12-23 08:11:46,2,2
539968351436,356060330,颜色分类:04D深松石绿;尺码:160/80A/S,绯***衣,296051132122,质感不是很好，700多合适，1000多买就太亏了，除非羊毛含量更高，会粘灰会起球，款式还好，平时穿160，这次也是160的，除了质感，其它的还满意,2016-12-18 18:38:38,4,0
539968351436,356060330,颜色分类:010黑/Black;尺码:160/80A/S,源***7,299851795813,客服态度不好，盒子回来烂的很厉害,2017-01-20 11:41:43,2,1
539968351436,356060330,颜色分类:010黑/Black;尺码:160/80A/S,莉***5,299719780138,实体店试过因为料子问题犹豫了没买，在去买的时候没有了，就在天猫买了，穿上去版型真的很好看，不过材质真的不是很好，粘毛严重。。。,2017-01-19 13:27:15,4,0
539968351436,356060330,颜色分类:010黑/Black;尺码:165/84A/M,l***0,296348950462,这件服装真的超级显气质，我169cm，55kg，m码正好,2016-12-18 23:47:23,3,2
539968351436,356060330,颜色分类:072铁锈红;尺码:170/88A/L,陈***蹦,298256585112,还行吧，穿了一天袖子那就起球球了，但是穿着怪好看的，估计穿不时间长，唉,2017-01-08 14:15:51,3,0
539968351436,356060330,颜色分类:106花灰;尺码:160/80A/S,珊***a,296453057722,净高166    54     平时穿165    &apos;这个衣服偏大，建议小一号。,2016-12-21 14:34:04,2,1
539968351436,356060330,颜色分类:04D深松石绿;尺码:165/84A/M,谢***霜,298394684301,蛮喜欢但是降价太快了接受不了，唉，，没有最低只有更低,2017-01-09 20:45:08,0,2
539968351436,356060330,颜色分类:010黑/Black;尺码:165/84A/M,花***1,296551982591,<b></b>此<b></b>用<b></b>户<b></b>没<b></b>有<b></b>填<b></b>写<b></b>评<b></b>论<b></b>!<b></b>,2016-12-14 12:32:52,0,0
539968351436,356060330,颜色分类:010黑/Black;尺码:165/84A/M,严***2,295877835533,衣服很厚实，版型也好。如果说不满意，那就是粘毛毛了,2016-12-16 23:16:29,2,1
539968351436,356060330,颜色分类:010黑/Black;尺码:160/80A/S,l***5,297475891700,在商场里面试好了回来拍的，比商场便宜了将近两百块，这款很显气质，个子高的女生穿起来特别有范儿。。。,2016-12-29 23:04:05,3,0
539968351436,356060330,颜色分类:106花灰;尺码:165/84A/M,s***9,296175695271,<b></b>此<b></b>用<b></b>户<b></b>没<b></b>有<b></b>填<b></b>写<b></b>评<b></b>论<b></b>!<b></b>,2016-12-11 17:57:21,2,0
539968351436,356060330,颜色分类:072铁锈红;尺码:170/88A/L,绮***r,297263911310,快递已经被拆过了，物流公司想干嘛,2016-12-28 15:25:51,3,1
539968351436,356060330,颜色分类:04D深松石绿;尺码:170/88A/L,畅***人,297003610647,本来以为湖蓝会显老，事实是特别的显气质，同事评价都说好，很高兴的留下了！本人身高173体重65公斤，L号正好！,2016-12-26 15:27:42,3,0
539968351436,356060330,颜色分类:010黑/Black;尺码:155/76A/XS,卡***拉,297769704417,除了款式不错，其他的都不值这个牌子和这个价，一拿到就要起球的料子和要掉的扣子。。。,2017-01-03 09:38:57,3,0
539968351436,356060330,颜色分类:106花灰;尺码:160/80A/S,一***听,297565100018,166的我穿上瞬间变成小矮子,2017-01-01 20:26:26,2,1
539968351436,356060330,颜色分类:010黑/Black;尺码:160/80A/S,章***哥,297633339905,感觉比实体店的薄，但质量还不错，黑色的真的比其他颜色的更好看更显气质！,2017-01-02 12:34:20,3,0
539968351436,356060330,颜色分类:04D深松石绿;尺码:165/84A/M,l***6,297775409320,物流快，款式挺好看但质量太差不值这个价，穿第二天袖子就磨毛了，穿第二次时就像一件旧衣服了，吊牌也剪了退也退不到都不想穿了好可惜,2017-01-02 15:26:38,0,0
539968351436,356060330,颜色分类:106花灰;尺码:170/88A/L,齐***1,296908767051,好看呢~本人179/62给大家参考,2016-12-27 09:33:45,3,1
539968351436,356060330,颜色分类:010黑/Black;尺码:165/84A/M,唯***2,298345537875,版型可以 但是料子不好 这个价钱可以买件质量不错的羊绒大衣了  不划算,2017-01-08 21:01:13,2,0
539968351436,356060330,颜色分类:04D深松石绿;尺码:175/92A/XL,j***8,296673750937,有点大了，可是肩膀还算正好，袖子太长了，样子还挺好看的，大气&hellip;但是就是一点不好，真的是太沉了太沉了太沉了&hellip;穿起来好累，哈哈哈哈哈哈哈哈，喜欢的款式没号了买的这件，希望可以补货继续搞活动，还会再来的,2016-12-22 10:40:01,4,0
539968351436,356060330,颜色分类:010黑/Black;尺码:160/80A/S,左***1,298448428743,和专柜试穿效果一样，大气。就是黑色比较容易粘灰。非常满意！,2017-01-11 09:15:51,0,0
539968351436,356060330,颜色分类:010黑/Black;尺码:175/92A/XL,w***7,296487608152,很长，比较收身，四个颜色中黑色最大气。,2016-12-21 19:51:37,3,0
539968351436,356060330,颜色分类:106花灰;尺码:160/80A/S,我***局,299947124591,衣服很喜欢，s码刚好合身，穿起来也挺好看的，就是腰还是有点宽松，不过有腰带到还好，不错，物流开始时有点慢，不过后来快递小哥挺负责的,2017-01-22 14:26:31,0,0
539968351436,356060330,颜色分类:106花灰;尺码:165/84A/M,h***a,296534015343,<b></b>此<b></b>用<b></b>户<b></b>没<b></b>有<b></b>填<b></b>写<b></b>评<b></b>论<b></b>!<b></b>,2016-12-12 04:19:06,0,0
539968351436,356060330,颜色分类:010黑/Black;尺码:175/92A/XL,s***n,297172240383,款式很好看显瘦，就是黑的比较爱沾毛什么的，真的长，165穿着到脚踝上一点，但是因为长也保暖！,2016-12-26 19:59:03,0,0
539968351436,356060330,颜色分类:010黑/Black;尺码:170/88A/L,毓***o,296116190728,聚划算690入手。非常霸气！长！厚！就是容易粘白毛毛,2016-12-18 20:05:28,3,0
539968351436,356060330,颜色分类:010黑/Black;尺码:170/88A/L,张***1,296882306027,身高177 的效果 适合170以上的,2016-12-26 13:14:26,3,1
539968351436,356060330,颜色分类:04D深松石绿;尺码:165/84A/M,王***2,297716577623,身高168体重115买的165号正好,2017-01-02 16:38:10,4,1
539968351436,356060330,颜色分类:04D深松石绿;尺码:165/84A/M,s***a,298257461835,挺长的风衣，看着还不错,2017-01-08 20:37:12,0,1
539968351436,356060330,颜色分类:04D深松石绿;尺码:160/80A/S,h***n,298753397280,商场同款，试了没有尺码，赶紧来官网买，是正品，比水鸳绿要深些，但是颜色没那么快过时,2017-01-12 14:30:03,0,0
539968351436,356060330,颜色分类:106花灰;尺码:155/76A/XS,深***7,296699145695,不知道为何，质量总感觉没有实体店的好！算了，便宜那么多，将就穿了。以后有钱钱了，还是去实体店买,2016-12-22 01:10:30,3,0
539968351436,356060330,颜色分类:04D深松石绿;尺码:170/88A/L,海***5,296323687671,大衣质量不错，是有点薄，孔雀绿很显白，但愿不起球,2016-12-19 22:37:14,0,0
539968351436,356060330,颜色分类:106花灰;尺码:170/88A/L,我***盒,298505913934,176   128斤  穿上大小合适  偏长了 穿平底不好看,2017-01-08 01:31:11,3,0
539968351436,356060330,颜色分类:010黑/Black;尺码:155/76A/XS,碎***s,298733491373,在店里看到，心水了很久，好不容易等到天猫打折，黑色修身又显个儿，特别好看！,2017-01-10 12:26:49,2,0
539968351436,356060330,颜色分类:072铁锈红;尺码:175/92A/XL,z***4,299876267335,之前在实体店里试穿的，但是没有大号，一直在网上找，网上也断货，直到前几天才有货，当机立断就买下来了。跟店里应该是一样的，手感还不错,2017-01-21 20:46:03,0,0
539968351436,356060330,颜色分类:072铁锈红;尺码:165/84A/M,知***b,299042217565,衣服很保暖 到货也快 没褶皱 长度到脚踝,2017-01-15 19:58:16,0,0
539968351436,356060330,颜色分类:04D深松石绿;尺码:165/84A/M,t***4,296742088008,很大气 做活动很划算,2016-12-24 20:02:42,3,2
