356060330,颜色分类:114粉红;尺码:160/80A/S,j***8,292504439244,粉粉的颜色，修身的版型都很喜欢，穿着也很合身，唯一美中不足的是袖子有点长了，当然这个不是衣服的问题，昨天去常州的only店没有这款羽绒服，但的确是2016年的款，双十一买很划算,2016-11-19 07:10:22,3,0
356060330,颜色分类:074大红;尺码:165/84A/M,小***筒,295233840525,购买的时候发货很快，由于之前拍小了一个号，换货商家可能处理流程比较复杂，等了好长时间，只好退货，又重新拍了件，客服人员的态度还是很好的,2016-12-10 23:31:38,3,0
356060330,颜色分类:114粉红;尺码:155/76A/XS,z***1,291866482663,本来看种的是另一款899元的，没有抢到号就拍了这款，拍完才发现用错50元的卷，客服说退款重拍，但是双十一退不了款，十二就没有卷了，哭晕啊！！好在上身效果不错，就是毛领太高了。,2016-11-16 17:39:37,3,2
356060330,颜色分类:114粉红;尺码:165/84A/M,无***君,292167165666,领子毛不是狐狸毛请注意，手感跟我的那件狐狸毛羽绒服差太多，其他部分还挺好的,2016-11-16 21:22:08,2,0
356060330,颜色分类:074大红;尺码:165/84A/M,h***3,292316669692,之前的几件羽绒服都是在专卖店购买的，只是这次在实体店没有我想要的颜色，双十一当晚就直接自选购物，也省得麻烦客服了，12号顺风快递神速就送到了，大红色颜色很正，上身效果特佳就和我当时在实体店试穿的效果一模一样！第二天不放心又特地去专柜验了货，果然是正品，大品牌果然值得信赖，必须?,2016-11-17 20:44:15,2,0
356060330,颜色分类:074大红;尺码:170/88A/L,朵***冰,298995297701,穿上非常合适，不跑绒就好,2017-01-13 22:57:17,0,0
356060330,颜色分类:114粉红;尺码:160/80A/S,t***6,291777030705,到货速度真快。顺丰。衣衣很漂亮。就是不耐脏。而且价格有点小贵(⊙o⊙)哦。希望以后多做活动。多打折。,2016-11-13 18:50:37,2,4
356060330,颜色分类:114粉红;尺码:160/80A/S,q***0,294455131865,165，53，本来下了单买的M，客服建议说S，纠结了好久，最后还是听了客服建议，买了S。然而收到货发现小了，手臂伸展不开，泪流...,2016-12-05 17:05:38,3,0
356060330,颜色分类:074大红;尺码:165/84A/M,爱***活,293427007888,颜色不正 没有图片红,2016-11-28 12:27:10,3,0
356060330,颜色分类:010黑/Black;尺码:165/84A/M,累***羊,292672859362,only家的衣服质量一直不错，就是价格有点小贵，但是毕竟一分货，一分价，质量还是相当不错的，穿上去暖暖的。,2016-11-21 07:49:14,2,0
356060330,颜色分类:074大红;尺码:160/80A/S,蚌***雅,298336573789,有点轻薄，但很暖和，这款衣服的毛领子不太好。,2017-01-07 13:37:49,3,0
356060330,颜色分类:010黑/Black;尺码:155/76A/XS,那***1,296394309998,保暖性好 前面领子不舒服 样子一般,2016-12-21 21:29:30,4,0
356060330,颜色分类:074大红;尺码:165/84A/M,p***1,296643922941,不错，毛毛比较长，厚度也合适！,2016-12-24 17:23:34,0,0
356060330,颜色分类:074大红;尺码:165/84A/M,朵***6,297569214270,很好，不错，只是用了Moda的盒子寄来，我混淆了，反正我都穿这两个牌子衣服,2016-12-31 15:30:18,4,0
356060330,颜色分类:114粉红;尺码:165/84A/M,琦***音,292508358378,衣服版型不错！穿着很暖和，就是有点线头！,2016-11-21 11:30:00,4,0
356060330,颜色分类:074大红;尺码:170/88A/L,可***源,291462351006,衣服颜色挺正的，和图片一个颜色。买的时候觉得有点小贵，还在担心质量怎么样，收到货后觉得物有所值，客服推荐的码非常合适。不得不说的是物流，店家居然给发的顺丰，11号晚上拍的，13号上午就到了，真的是飞快。,2016-11-13 19:32:02,2,0
356060330,颜色分类:114粉红;尺码:170/88A/L,花***9,294566751023,不错旗舰店发的货，穿了一次，貌似有点掉毛毛。双十一时买了条裤子也很好，值得信赖的品牌！！,2016-12-06 17:13:00,3,0
356060330,颜色分类:010黑/Black;尺码:155/76A/XS,海***9,296067830722,这款羽绒服比较厚实，穿上挺暖和，长度也合适，在膝盖以上,2016-12-16 19:38:42,4,0
356060330,颜色分类:010黑/Black;尺码:165/84A/M,抽***殿,292334737435,衣服的包包有个洞。虽然缝上就没啥影响，但是花一千多块钱买个有瑕疵的东西，谁心里都不痛快。麻烦发货的时候检查一下。让人怀疑这是不是正品。,2016-11-18 14:52:48,2,0
356060330,颜色分类:114粉红;尺码:165/84A/M,明***水,291582193748,双十一中午下的单，今天中午就收到了，发货、物流确实很快，衣服质量什么的都挺好，一直都喜欢only的衣服，就是应该是退换的货，包装袋原来应该有坏的，还贴着退换货专用的胶布，质量没有问题也是不太舒服，以后怎么着也可以换个新的塑料袋吧！还有，一直以来only都是用纸盒子包装，只用胶布封了口，物流这么暴力，盒子都有些烂了，建议以后再外面在包个硬一些的袋子。,2016-11-13 20:27:38,3,0
356060330,颜色分类:010黑/Black;尺码:155/76A/XS,米***悔,292334750513,还不错，厚实，小贵,2016-11-18 18:41:51,4,3
356060330,颜色分类:114粉红;尺码:165/84A/M,忘***2,292933478567,颜色有色差，大小还可以，质量就那样吧,2016-11-21 13:36:06,3,0
356060330,颜色分类:114粉红;尺码:160/80A/S,s***0,293749772851,颜色不是很粉。那个腰带啊。是真心的很丑,2016-11-27 21:06:44,2,0
356060330,颜色分类:010黑/Black;尺码:170/88A/L,d***6,292396612503,差评，差评，衣服有问题，发了几次图片，竟然没人理会，将就穿吧，懒得退！包装也不仔细，购物袋都没有，总之不满意！不满意不满意！,2016-11-18 22:28:03,2,2
356060330,颜色分类:010黑/Black;尺码:165/84A/M,郭***鑫,295058822927,就那样吧，尺寸与描述不符，价格太贵，买稍微贵点的东西还是谨慎点为好,2016-12-09 01:16:24,3,0
356060330,颜色分类:114粉红;尺码:165/84A/M,美***0,296029702393,愉快的购物。很快到货。穿了几天，竟收到了退款的短信，退还了259.8元的差价。意外惊喜。,2016-12-19 14:05:38,2,0
356060330,颜色分类:114粉红;尺码:165/84A/M,我***x,292544221237,<b></b>此<b></b>用<b></b>户<b></b>没<b></b>有<b></b>填<b></b>写<b></b>评<b></b>论<b></b>!<b></b>,2016-11-19 09:16:52,0,0
356060330,颜色分类:010黑/Black;尺码:175/92A/XL,s***v,295354864177,还可以 质量蛮好 就是太贵了。,2016-12-11 15:35:22,3,0
356060330,颜色分类:010黑/Black;尺码:165/84A/M,极***8,291679273507,大爱这件羽绒服，长度合适，本人164cm，95斤，买的M码，穿上非常合身，款式也很喜欢，尤其帽子上的毛毛真的太稀饭了，含绒量90%，穿着很暖和，里面还有两个暗兜，很实用，真的很惊喜，这是我双十一收到的第一件宝贝也是最喜欢最满意的宝贝，必须满分！,2016-11-15 19:49:20,4,0
356060330,颜色分类:010黑/Black;尺码:170/88A/L,航***4,295901424079,质量没有想象中那么好，还不知道跑不跑绒,2016-12-15 17:04:16,3,0
356060330,颜色分类:010黑/Black;尺码:155/76A/XS,d***8,294832504741,大小合适，下次继续购买。,2016-12-09 10:43:43,4,0
356060330,颜色分类:114粉红;尺码:160/80A/S,f***9,296373308870,很好，很满意，充绒量足！而且是同城快递，特别快！(选最近的实体店发的货),2016-12-19 10:14:02,4,0
356060330,颜色分类:010黑/Black;尺码:165/84A/M,梦***痕,293989110342,同事说挺好看，第一次买ONLY的还不错,2016-12-02 14:08:23,3,0
356060330,颜色分类:010黑/Black;尺码:155/76A/XS,p***2,294135992882,款型很好，上身效果很棒。很暖和！,2016-12-02 22:24:06,2,0
356060330,颜色分类:010黑/Black;尺码:165/84A/M,w***6,294351755293,挺好的，喜欢，是正品值得拥有！物有所值！,2016-12-04 10:04:56,0,0
356060330,颜色分类:010黑/Black;尺码:165/84A/M,2***晴,296197093446,不好意思收货晚了，看的出来家人很喜欢,2016-12-20 09:45:19,2,0
356060330,颜色分类:010黑/Black;尺码:170/88A/L,l***艳,295776989240,参考评论里面的意见，买大了一个号，很合适，很暖和！超级满意,2016-12-15 09:04:44,0,0
356060330,颜色分类:074大红;尺码:155/76A/XS,y***1,296182193978,比原来的号大了。一直都是买XS，今年这件有点儿肥了,2016-12-19 12:21:54,4,0
356060330,颜色分类:010黑/Black;尺码:160/80A/S,徐***7,294654811627,保暖性：宝贝物流很快，整体满意，卖家包装的很好。。,2016-12-07 00:00:07,0,0
356060330,颜色分类:010黑/Black;尺码:175/92A/XL,y***8,293428259741,老妈穿着暖和的很，希望以后还有大点码，老妈喜欢这件的款式，毛领，所以不舍得退货，就把衣服留下了了，但是真心对腰粗的老人来说有点小，大家购买可参考,2016-11-25 20:04:10,0,0
356060330,颜色分类:010黑/Black;尺码:165/84A/M,c***8,294642906870,客服态度超nice，分分钟发货，第二天就收到货了，衣衣包装得也很好，还有小票，绝对是正品。,2016-12-05 22:07:03,2,0
356060330,颜色分类:074大红;尺码:175/92A/XL,酷***屋,295019193488,我自己买了一件这件帮朋友买的很喜欢,2016-12-12 02:52:43,2,0
356060330,颜色分类:010黑/Black;尺码:160/80A/S,2***a,292140581073,衣服很早就收到了，很喜欢，北京最近要降温了，过几天穿穿试试保不保暖，就是有点遗憾，买的瘦点了，要是再大一码就好了,2016-11-17 20:31:32,2,1
356060330,颜色分类:010黑/Black;尺码:170/88A/L,w***9,294933475981,买给妈妈吗的 还可以,2016-12-07 22:48:19,4,0
356060330,颜色分类:074大红;尺码:155/76A/XS,家***6,291703474894,"颜色比图片暗一些，没那么亮，不过版型很好，很修身，大小刚刚合适，159,50公斤，xs码！很暖和！我喜欢only的衣服，质量和细节都处理的很好，基本都是他家的！",2016-11-15 21:34:57,3,2
356060330,颜色分类:114粉红;尺码:170/88A/L,m***c,295291992216,颜色很嫩，毛领较高，不错,2016-12-13 12:48:57,3,0
356060330,颜色分类:074大红;尺码:175/92A/XL,芳***1,298499620069,质量不错，就是实物颜色偏暗些，不过也挺不错，总体好评,2017-01-08 22:36:26,0,0
356060330,颜色分类:010黑/Black;尺码:170/88A/L,无***脱,295586170657,衣服很好，女朋友很喜欢，修身款，建议大一号,2016-12-14 12:14:45,0,0
356060330,颜色分类:114粉红;尺码:175/92A/XL,金***园,295452468182,做工有不少线头,2016-12-13 16:21:24,3,0
356060330,颜色分类:010黑/Black;尺码:165/84A/M,z***t,292606913406,真是太好了，就是稍微有点紧，最近胖了不少，以后有活动再买件粉色的,2016-11-20 12:48:06,3,0
356060330,颜色分类:010黑/Black;尺码:170/88A/L,d***2,294893924596,好看合身，反正就是各种美，在专柜试过才买的。,2016-12-08 16:25:15,2,0
356060330,颜色分类:010黑/Black;尺码:160/80A/S,y***l,293079577844,160 &mdash;100斤。穿s有点小了，换成m的 。衣服挺好，售后客服回复太慢了。,2016-11-22 15:31:26,2,0
356060330,颜色分类:010黑/Black;尺码:175/92A/XL,k***5,293651327898,买了就有100优惠卷可以用这什么情况！?无语,2016-11-29 21:32:08,3,0
356060330,颜色分类:114粉红;尺码:160/80A/S,亮***s,293413630215,收腰款型，很漂亮。不过有点薄，希望最冷的时候能hold住。,2016-11-26 16:18:35,3,0
356060330,颜色分类:074大红;尺码:155/76A/XS,d***3,292103391265,发货速度确实很快，衣服也挺好的。就是收到的时候包装已经坏了，今天看到新闻说快递员乱扔快递的，哎。。。,2016-11-17 22:41:46,3,1
356060330,颜色分类:010黑/Black;尺码:170/88A/L,雪***6,294327226472,衣服修身漂亮，货从北京大兴发的，不管怎么说也是1千多的衣服，直接装个破塑料袋就发货，盒子也没有,2016-12-02 18:38:03,3,0
356060330,颜色分类:114粉红;尺码:160/80A/S,煙***味,294845038292,质量很好，上身很好看，就是怕粉色不耐脏，羽绒服洗多了也不好,2016-12-07 22:33:46,3,0
356060330,颜色分类:114粉红;尺码:175/92A/XL,自***者,299318820109,比想象中还好，很喜欢这件，暖暖的，颜色也正。帽子还是可以拆的，简直不能再棒,2017-01-15 23:30:42,0,0
356060330,颜色分类:074大红;尺码:155/76A/XS,9***潘,296538906334,差评 色差太大 完全就是两个颜色！,2016-12-21 09:03:49,3,0
356060330,颜色分类:010黑/Black;尺码:175/92A/XL,追***呵,293316715683,双十一买的，和现在就错了五毛钱，真是无语&hellip;&hellip;,2016-11-26 16:41:51,2,0
356060330,颜色分类:114粉红;尺码:160/80A/S,失***2,293681783089,衣服是很好看，但是双十一购物今天才收到，前面丢货又补发了一件，客服太多，很乱，反应问题处理不及时，物流处理很快，补发的速度很快&hellip;&hellip;,2016-11-27 20:16:09,2,0
356060330,颜色分类:074大红;尺码:160/80A/S,赵***6,299046548880,第二件了，超级棒，毛领比黑色的好。,2017-01-14 18:34:09,3,0
356060330,颜色分类:114粉红;尺码:165/84A/M,l***2,296415917310,腰带我不是很喜欢，总感觉腰带和店里不一样，其他没问题，价格合适,2016-12-19 21:02:50,3,0
356060330,颜色分类:114粉红;尺码:175/92A/XL,l***5,292674795430,款式很好看，简单大方，羽绒感觉很轻，很厚，就是颜色有点浅，不耐脏。,2016-11-21 14:23:00,4,0
356060330,颜色分类:074大红;尺码:160/80A/S,y***凉,296683324004,<b></b>貌<b></b>似<b></b>不<b></b>错<b></b>,2016-12-24 20:59:08,2,0
356060330,颜色分类:010黑/Black;尺码:170/88A/L,欣***7,294069487831,完美。一千多块花的太值了,2016-12-03 02:14:33,3,2
356060330,颜色分类:114粉红;尺码:155/76A/XS,恬***菇,295209776886,不错，很保暖,2016-12-11 09:19:50,4,0
356060330,颜色分类:010黑/Black;尺码:165/84A/M,h***3,294779385925,暖和，但一波三折,2016-12-05 19:56:59,3,0
356060330,颜色分类:010黑/Black;尺码:170/88A/L,a***7,295371763057,帮别人买的，据说不错！,2016-12-14 14:57:32,4,0
356060330,颜色分类:010黑/Black;尺码:160/80A/S,q***3,295886590949,<b></b>此<b></b>用<b></b>户<b></b>没<b></b>有<b></b>填<b></b>写<b></b>评<b></b>论<b></b>!<b></b>,2016-12-11 13:42:40,0,0
356060330,颜色分类:114粉红;尺码:175/92A/XL,宝***哈,291794394515,就近商场颐堤港发的货，可以肯定是专柜正品。尺码偏小，得选大一号。衣服版型穿上显瘦，做工也不错，但是粉色跟图片是有色差的。 衣服毛领有瑕疵，毛领有两块地方不知道是压着了还是就缺少两块毛，感觉这毛领不完美。,2016-11-14 17:02:07,4,0
356060330,颜色分类:074大红;尺码:160/80A/S,m***0,292364131133,质量、做工不错，穿着柔软舒适轻便，不算太厚，东北初冬季节还可以。红色比图片稍深，不过对我来说正好。满意，全5分 考虑东北冬天冷，比平常买大一码，合适 双11发货挺快的，赞一个！,2016-11-20 11:46:16,3,0
356060330,颜色分类:010黑/Black;尺码:155/76A/XS,t***3,292100296679,话说质量是过关的，这款衣服，没啥亮点但也没啥槽点，纠结两天决定留下了！真心说有点小贵！另外我买最小号，给我发了一个L码的腰带，系了和没系一样！算了，反正这衣服适合敞开穿,2016-11-17 22:30:01,3,0
356060330,颜色分类:010黑/Black;尺码:165/84A/M,l***6,294584143637,衣服非常好,2016-12-07 16:52:41,2,0
356060330,颜色分类:010黑/Black;尺码:160/80A/S,招***9,294538922257,可以，不错，都说蛮好看的，快递也快,2016-12-04 11:10:06,0,0
356060330,颜色分类:074大红;尺码:160/80A/S,h***8,294505331596,质量还好，不错,2016-12-03 14:40:11,4,0
356060330,颜色分类:074大红;尺码:155/76A/XS,t***3,294302429806,感觉有点长，其它还好！,2016-12-02 22:46:04,3,0
356060330,颜色分类:010黑/Black;尺码:160/80A/S,小***6,294762029216,不错，应该是正品,2016-12-06 09:23:35,2,0
356060330,颜色分类:010黑/Black;尺码:165/84A/M,r***k,295161506153,很好，穿上很漂亮！,2016-12-11 20:21:09,3,0
356060330,颜色分类:074大红;尺码:160/80A/S,p***9,291568932524,老婆期待的ONLY大牌终于到手了，衣服质量非常好，买的货真价实，物流也很给力真叫速度，就说这么多了，总之宝贝儿很喜欢萌萌嗒。,2016-11-13 15:09:38,2,1
356060330,颜色分类:074大红;尺码:155/76A/XS,上***姐,291456095146,还行吧，红色的搭黑色靴子好看一点，应该买粉色的。给个图片供大家参考,2016-11-13 16:33:07,0,1
356060330,颜色分类:074大红;尺码:170/88A/L,曾***4,296531587551,买only家衣服可以，但是要退货就麻烦了，他们家售后很忙的，几乎都不理人，以后再喜欢还是去实体店买，网购让人太不省心了,2016-12-20 14:12:40,4,0
356060330,颜色分类:114粉红;尺码:170/88A/L,j***光,296307824685,还不错哦，稍有些大了,2016-12-19 09:15:19,3,0
356060330,颜色分类:114粉红;尺码:170/88A/L,a***3,291667990791,我一般收到东西不好就不会评价，这次衣服真的挺好的，然后双十一还搞活动，不错嗯，那个腰带，其实不用戴上也挺挺好像好一点。,2016-11-12 21:20:27,0,1
356060330,颜色分类:114粉红;尺码:165/84A/M,s***7,296115511078,做工超赞，非常满意,2016-12-17 16:43:50,3,0
356060330,颜色分类:010黑/Black;尺码:160/80A/S,y***0,296170680462,好评。媳妇儿很喜欢,2016-12-19 15:22:31,4,0
356060330,颜色分类:010黑/Black;尺码:160/80A/S,x***6,293572479719,老妈穿着挺合适的，就是稍微有点紧。还不错。,2016-11-28 23:47:59,3,0
356060330,颜色分类:010黑/Black;尺码:160/80A/S,x***9,293839955022,超快速第二天下午就到，只是买小了，又寄回去换,2016-12-01 11:44:15,3,0
356060330,颜色分类:010黑/Black;尺码:170/88A/L,道***王,296570225503,"买来1069.结果过了几天大降价，狗 的日的，两件衣服亏了近1000,有个客服不错，一直安慰，但有什么用",2016-12-22 16:03:04,3,0
356060330,颜色分类:114粉红;尺码:160/80A/S,y***1,295645357268,很实体店的一样，但是感觉到有点薄,2016-12-14 09:13:43,2,0
356060330,颜色分类:074大红;尺码:165/84A/M,a***6,293429013969,衣服质量很好，没毛病，双十一购买的，之前买的号小，退货重新拍一件，发货快，顺丰快递，物流非常快,2016-11-27 19:31:08,3,0
356060330,颜色分类:074大红;尺码:165/84A/M,笑***5,297405769690,很厚实，穿着很漂亮，带上腰带显得腰部很瘦,2016-12-28 20:40:01,2,0
356060330,颜色分类:114粉红;尺码:160/80A/S,西***猫,291831947508,快递太棒了。。。天津到云南，居然只用了一天，质量也蛮好，稍微有一丢丢色差，但是可以接受，穿上爸妈都说好看,2016-11-15 17:22:57,0,0
356060330,颜色分类:074大红;尺码:165/84A/M,z***5,297695180522,保暖性：漂亮保暖，就是毛领不是很好。。,2017-01-03 09:26:09,4,0
356060330,颜色分类:010黑/Black;尺码:170/88A/L,s***l,292925791281,大小正好，毛领拆了只要帽子更舒服，穿上挺暖和的，满意～,2016-11-23 19:50:37,4,0
356060330,颜色分类:010黑/Black;尺码:165/84A/M,z***9,292843421476,含绒量还可以，比较厚实 不错，就是带的腰带不是很好,2016-11-21 11:09:53,3,0
356060330,颜色分类:114粉红;尺码:170/88A/L,小***1,297179174487,穿上很漂亮，颜色也好看,2016-12-26 21:41:16,3,0
356060330,颜色分类:074大红;尺码:170/88A/L,高***在,296333491068,衣服面料没有达到预期效果，但上身效果还行，物流快,2016-12-22 06:43:24,0,0
356060330,颜色分类:010黑/Black;尺码:165/84A/M,l***i,295933853612,偏瘦，但是客服大爷们太牛X了，6个小时一点反应没有。,2016-12-16 14:40:32,4,0
356060330,颜色分类:010黑/Black;尺码:160/80A/S,糖***啊,293279869328,是专柜直接发货的，应该是正品，就是没有购物袋，很遗憾，身高157，体重47kg，穿xs紧，所以又买的s,2016-11-24 15:50:43,4,0
356060330,颜色分类:010黑/Black;尺码:160/80A/S,k***k,291769635752,穿上后背腰线好看,2016-11-14 01:51:31,3,0
356060330,颜色分类:114粉红;尺码:165/84A/M,s***5,295047427865,发来的帽子领后面全是黑的，好长时间才看见，现在也没法退了，真是坑人啊！,2016-12-09 07:03:57,2,0
356060330,颜色分类:010黑/Black;尺码:160/80A/S,美***健,292649977541,没有想象的那么后厚，面料不是很好,2016-11-22 11:19:55,2,0
356060330,颜色分类:114粉红;尺码:170/88A/L,t***7,291890226924,只有一个方向的拉链，从下面拉不开，平时坐着的时候只能把拉链全拉开，或者坐羽绒服上，帽子上的毛领没有办法拆卸，不太冷的时候看着有点夸张,2016-11-16 19:49:52,3,0
356060330,颜色分类:010黑/Black;尺码:155/76A/XS,雨***h,294426023515,还不错，就是毛领真的有点太高了！其他还好！穿了几天，不跑毛！,2016-12-04 08:03:18,2,0
356060330,颜色分类:074大红;尺码:165/84A/M,y***3,299007141081,宝贝太喜欢了，大小合适，是我喜欢的款式，还会关注,2017-01-14 14:26:59,2,0
356060330,颜色分类:074大红;尺码:175/92A/XL,c***t,292810573247,衣服很轻，褶皱有点多，感觉不便宜,2016-11-20 23:55:45,3,0
356060330,颜色分类:114粉红;尺码:160/80A/S,我***y,295399597601,想说的是帽子上有个油笔道，售后一直不搭理我。,2016-12-12 22:35:38,3,0
356060330,颜色分类:010黑/Black;尺码:165/84A/M,y***0,292535314157,在店里看了好多次～还是决定买这款～特别好看显气质～大爱only,2016-11-20 11:07:27,3,0
356060330,颜色分类:010黑/Black;尺码:165/84A/M,t***滢,293361955392,毛领还是感觉缺一块，希望晾晾会好点～不过客服态度都很好～五分好评～,2016-11-24 19:19:54,2,0
356060330,颜色分类:074大红;尺码:165/84A/M,小***1,295746760555,<b></b>此<b></b>用<b></b>户<b></b>没<b></b>有<b></b>填<b></b>写<b></b>评<b></b>论<b></b>!<b></b>,2016-12-15 09:37:11,0,0
356060330,颜色分类:074大红;尺码:160/80A/S,我***6,296577752256,挺好的，这个时候买价格很合适！北京过冬没问题！,2016-12-23 10:27:24,0,0
356060330,颜色分类:114粉红;尺码:155/76A/XS,t***5,291699206678,衣服上有脏点 内衬是破的 联系客服解决全是自动回复后就没有下文 糟糕！！！,2016-11-13 09:49:33,4,2
356060330,颜色分类:010黑/Black;尺码:170/88A/L,梧***0,292332848783,一分价钱一分货啊！大品牌就是大品牌，物流很快，质量就是不一样。各种细节做工都很好。一直喜欢only家衣服，穿过就知道了，不过挺薄的，很显瘦！,2016-11-17 21:19:20,0,0
356060330,颜色分类:010黑/Black;尺码:175/92A/XL,z***8,294830749325,女儿一直在穿很合身，也不着灰，不掉毛，都不错,2016-12-06 17:56:36,3,0
356060330,颜色分类:074大红;尺码:175/92A/XL,专***贝,292710080519,这件羽绒服买给妈妈的，直接寄给妈妈所以没有看到实物，但是妈妈特别喜欢很满意～,2016-11-20 11:09:29,3,0
356060330,颜色分类:010黑/Black;尺码:160/80A/S,j***2,292848123079,给女友买的，穿着很合身，到货速度快，没的说,2016-11-22 00:20:03,2,0
356060330,颜色分类:010黑/Black;尺码:165/84A/M,声***声,291592963047,好看，送给妈咪的礼物,2016-11-15 10:00:11,2,1
356060330,颜色分类:010黑/Black;尺码:170/88A/L,s***4,292302599266,羽绒服是瘦版的，穿上显身材，厚度略薄，时尚,2016-11-17 19:13:41,0,0
356060330,颜色分类:074大红;尺码:160/80A/S,j***u,297651426169,稍微有点色差，质量不错,2017-01-01 20:21:29,3,0
356060330,颜色分类:074大红;尺码:165/84A/M,1***n,291789467944,大红色很正，身高165体重102斤，胸围84腰围69，M码刚刚好，我觉得如果换L码会更合适一些。值得一提的是衣服里面左右有两个内兜，非常实用。,2016-11-15 20:42:18,0,0
356060330,颜色分类:074大红;尺码:175/92A/XL,j***1,291968080573,速度超快，双11下单，12号中午就收到了，好棒。衣服颜色亮丽，很暖和。腰带太紧了，反而不好看,2016-11-15 13:02:25,3,0
356060330,颜色分类:114粉红;尺码:160/80A/S,l***8,296959150859,拉链不露出来更好,2016-12-27 08:34:17,0,0
356060330,颜色分类:010黑/Black;尺码:160/80A/S,芝***3,291598959886,很暖和，本来属意粉色加小号，但手慢了，S码大了一丁点。黑色虽不是很靓，但耐脏。,2016-11-15 10:38:34,4,0
356060330,颜色分类:074大红;尺码:170/88A/L,w***0,296279083502,<b></b>此<b></b>用<b></b>户<b></b>没<b></b>有<b></b>填<b></b>写<b></b>评<b></b>论<b></b>!<b></b>,2016-12-12 00:11:07,0,0
356060330,颜色分类:074大红;尺码:155/76A/XS,恒***颗,296447228823,颜色有点色差，很暖和，很修身。还是满意的。喜欢。,2016-12-19 19:23:40,2,0
356060330,颜色分类:114粉红;尺码:165/84A/M,w***5,295841943763,<b></b>此<b></b>用<b></b>户<b></b>没<b></b>有<b></b>填<b></b>写<b></b>评<b></b>论<b></b>!<b></b>,2016-12-07 16:16:07,4,0
356060330,颜色分类:010黑/Black;尺码:160/80A/S,t***1,294902283865,没有信用，爱答不理的，这么多年第一次差评！！！,2016-12-10 10:06:04,2,0
356060330,颜色分类:114粉红;尺码:175/92A/XL,冰***6,296720562913,版型很好看。颜色也很好，拉链头有点小问题，客服也给很好的处理了,2016-12-25 15:00:40,4,0
356060330,颜色分类:114粉红;尺码:155/76A/XS,倾***老,292475598322,挺漂亮的，很修身。我158，体重82斤。就是感觉比想象中的羽绒服要薄一点。双十一下单，第二天一早就到，非常快！,2016-11-19 17:14:58,0,0
