356060330,颜色分类:010黑色Black;尺码:160/80A/S,只***短,295200347243,喜欢大毛领～,2016-12-12 13:55:00,3,1
356060330,颜色分类:126沙色GRAY SAND;尺码:170/88A/L,t***4,294010984365,没在实店试过，直接购买的，一直很喜欢only的衣服，期望很高，总体还可以。,2016-12-01 12:48:49,2,0
356060330,颜色分类:010黑色Black;尺码:160/80A/S,y***2,296371244357,还不错,2016-12-21 17:30:34,3,1
356060330,颜色分类:126沙色GRAY SAND;尺码:170/88A/L,荼***j,295695181924,衣服质量很好，体现大牌品质,2016-12-15 10:13:56,2,0
356060330,颜色分类:126沙色GRAY SAND;尺码:165/84A/M,暮***系,292069902552,去年有同款，比这个含绒量高，比这个短一点，腰带不一样。,2016-11-17 00:30:44,4,1
356060330,颜色分类:010黑色Black;尺码:160/80A/S,c***3,292500516415,购买时我报了尺寸，客服推荐S，页面还显示七天可退换，买回来瘦了，客服说下架了。我发现这款衣服只有双十一活动有货，活动前和活动后都没有货，不知道什么意思。快递用的ESM，慢的不像话，光揽货用了三四天，寄过来用了八天。,2016-11-19 15:51:43,0,0
356060330,颜色分类:126沙色GRAY SAND;尺码:170/88A/L,2***6,297425801498,稍大了，所以也长了一点，很保暖，有腰带还能修身！,2017-01-01 10:38:01,4,0
356060330,颜色分类:010黑色Black;尺码:165/84A/M,心***1,295081175384,质量不错，尺码略微偏大，目前还没到穿的温度～不过这个价格真心不便宜,2016-12-09 23:55:07,3,0
356060330,颜色分类:010黑色Black;尺码:160/80A/S,是***像,294494080304,保暖必备，黑的很百搭不会过时。衣服质量也是刚刚滴。,2016-12-03 13:15:11,4,0
356060330,颜色分类:126沙色GRAY SAND;尺码:170/88A/L,t***8,292458687794,我不太满意，来的时候盒子都碎啦！要求改地址自己出运费要求了好几遍也不给改,2016-11-20 16:05:37,0,0
356060330,颜色分类:010黑色Black;尺码:170/88A/L,饭***0,294504426037,拉链百分百有问题，这么大的品牌，细节方面做的太差，拉一次得卡两次，最下面的扣，百分之百的会卡，不推荐！,2016-12-03 22:52:38,2,0
356060330,颜色分类:126沙色GRAY SAND;尺码:165/84A/M,t***9,294984302655,好长，穿上很暖和，毛毛不错,2016-12-10 15:07:50,3,0
356060330,颜色分类:126沙色GRAY SAND;尺码:160/80A/S,l***g,295954165310,衣服很好，赶上折扣还是蛮合适的，穿上效果不错。,2016-12-17 15:18:54,4,0
356060330,颜色分类:010黑色Black;尺码:170/88A/L,雪***妹,294691517774,双十一的时候买的真的还觉得挺值得。宝贝质量当然是没的说，需要的就是好的。,2016-12-05 23:39:56,4,0
356060330,颜色分类:010黑色Black;尺码:170/88A/L,萍***3,292664110796,非常暖和，而且不算显胖，冬天有它就够了,2016-11-21 09:31:40,2,0
356060330,颜色分类:126沙色GRAY SAND;尺码:175/96A/XXL,t***4,296080191974,好多圆柱笔划痕啊，和客服说客服也不理我,2016-12-19 20:37:06,3,3
356060330,颜色分类:010黑色Black;尺码:170/88A/L,t***9,293901036897,双11买的，发货速度非常快，穿上可以到膝盖以下，不用穿棉裤就可以了，还是比较满意。现在天气还不冷，还没有穿。,2016-11-28 22:12:19,3,0
356060330,颜色分类:126沙色GRAY SAND;尺码:170/88A/L,1***l,293767480910,衣服还可以，售后说着说着就没人了。。。习惯好评吧,2016-11-29 23:23:54,4,0
356060330,颜色分类:010黑色Black;尺码:155/76A/XS,夏***哒,292280464333,很修身，整体不错，在实体店没看到这一款，试的是另一款，不过这个也穿上也挺好看的，同事们都说好看，就是毛毛领显得不太上档次，其他都挺好,2016-11-17 06:28:03,2,0
356060330,颜色分类:010黑色Black;尺码:165/84A/M,t***2,292103600931,蓬松度：羽绒服一切都是美美哒，厚厚的，大毛领，长到小腿，一切都是完美的。只是想问问设计师：拉上拉链后走路只能迈小步，走碎步，这么长的羽绒服，难道就没有考虑到这些细节么？。,2016-11-16 17:12:11,4,0
356060330,颜色分类:126沙色GRAY SAND;尺码:170/88A/L,w***8,293114555108,不错，但是没有想象的厚实，比预期的长一点，总体还是很不错的，,2016-11-24 13:08:39,3,0
356060330,颜色分类:126沙色GRAY SAND;尺码:160/80A/S,黑***5,292462197140,有色差，不是很喜欢，双十一价格很划算，但是店里的更厚实，希望照片以后更真实。,2016-11-19 18:47:08,2,0
356060330,颜色分类:126沙色GRAY SAND;尺码:160/80A/S,m***2,294738428185,双十一不能和其他宝贝一起付款，这次活动多付了50大洋，不过衣衣很喜欢，很保暖,2016-12-08 07:07:15,3,0
356060330,颜色分类:126沙色GRAY SAND;尺码:170/88A/L,小***汤,293710946147,先好评 发回老家的 到现在衣服都没看到 希望大小合适就行 到时候再追评价,2016-11-29 09:34:10,4,0
356060330,颜色分类:126沙色GRAY SAND;尺码:165/84A/M,w***g,297850401743,特别好，衣服样子收身都很好看，很显年轻,2017-01-03 12:50:47,2,0
356060330,颜色分类:010黑色Black;尺码:160/80A/S,三***1,289668584824,东西还行，很大一只，缺点是外层面料有点显旧，没有图片上亮，有点钻绒,2016-10-29 16:51:18,4,0
356060330,颜色分类:010黑色Black;尺码:160/80A/S,t***1,291820806418,质量没的说，这个价位简直就是捡到便宜了,2016-11-14 02:53:31,3,1
356060330,颜色分类:010黑色Black;尺码:170/88A/L,我***9,294051974740,版型非常赞，面料离远看上去有点像皮的，嗯脏了话一擦就可以1年洗一次就像啦！非常赞。,2016-11-30 00:54:03,2,0
356060330,颜色分类:010黑色Black;尺码:165/84A/M,l***6,292817176249,合适，还不错，冬天有长款啦，价格给力?ヽ(*?з｀*)?,2016-11-22 14:44:19,3,0
356060330,颜色分类:126沙色GRAY SAND;尺码:175/92A/XL,3***l,292591234852,保暖性：羽绒服 颜色款式都非常好 喜欢 希望以后多出点 大码的。,2016-11-21 19:43:34,3,0
356060330,颜色分类:126沙色GRAY SAND;尺码:160/80A/S,王***2,295391258747,做工与质量都比较满意，很愉快的一次购物，大品牌名不虚传。,2016-12-13 12:40:56,4,0
356060330,颜色分类:126沙色GRAY SAND;尺码:170/88A/L,a***6,293198204974,沙色还行，但是黑色应该更好看显瘦,2016-11-23 13:28:31,3,0
356060330,颜色分类:010黑色Black;尺码:175/92A/XL,l***6,297137417342,衣服很喜欢 也很暖和 有一点点漏毛毛 但是问题不大,2016-12-29 11:08:30,3,0
356060330,颜色分类:126沙色GRAY SAND;尺码:160/80A/S,王***9,291654127783,羽绒服确实很漂亮，虽然本人个子矮，但是实在禁不住诱惑，好在是修身款，不会显得长的过分。衣服质量很不错，只是不知道70%的含绒量能不能抵御今年的寒冬啊 发货速度很快,2016-11-15 11:32:42,2,0
356060330,颜色分类:126沙色GRAY SAND;尺码:165/84A/M,b***s,291552722977,有点色差，实物是香槟色。质量很好，上身漂亮。版型是瘦款，丰满的妹纸慎买！,2016-11-14 16:48:57,4,0
356060330,颜色分类:010黑色Black;尺码:155/76A/XS,t***0,292267528309,虽然没有大家那么满意，主要觉得羽绒外面的面料像防水布，不太喜欢，质量还是不错，简简单单的款式,2016-11-18 13:37:55,0,0
356060330,颜色分类:010黑色Black;尺码:155/76A/XS,小***歪,292188486693,一直买这个牌子的羽绒服，从未失望过，质量好，尺码合身，好评呢。,2016-11-16 15:07:47,4,3
356060330,颜色分类:126沙色GRAY SAND;尺码:170/88A/L,仁***久,292168048699,衣服挺好的，厚实，l号的我穿起来特别合适，这个价格抢到值了,2016-11-16 18:45:01,2,0
356060330,颜色分类:010黑色Black;尺码:165/84A/M,0***2,293409766335,羽绒服特别喜欢，就等双十一下手呢，毛领也高大上，赞,2016-11-28 11:10:44,3,0
356060330,颜色分类:010黑色Black;尺码:170/88A/L,t***0,293910704818,款式质量都不错，就是个子170以下的mm就算了！看看模特的身高就绝望吧！,2016-11-29 17:05:44,3,0
356060330,颜色分类:010黑色Black;尺码:165/84A/M,6***9,291748307453,大爱 好喜欢 同事看了还想买几件 可是没有货了 好可惜,2016-11-13 15:58:12,0,2
356060330,颜色分类:126沙色GRAY SAND;尺码:170/88A/L,苑***崴,292696668040,这件宝贝穿上很显气质。，显我瘦显我高，总之是美美嗒啦！,2016-11-21 23:35:01,0,0
356060330,颜色分类:126沙色GRAY SAND;尺码:160/80A/S,勤***豆,292101733730,收到货了，衣服做工还可以，毛领挺舒服的，但是感觉衣服本身有一点色差呢，比图片颜色深而且比较暗，基本接近卡其色感觉。,2016-11-17 18:57:16,3,0
356060330,颜色分类:010黑色Black;尺码:165/84A/M,悠***梅,294375957648,喜欢，忠实粉丝。喜欢模特的搭配。,2016-12-04 23:23:25,4,1
356060330,颜色分类:126沙色GRAY SAND;尺码:165/84A/M,b***1,293973711308,衣服够长够保暖，过冬不怕了，唯一感觉遗憾就是帽子不能拆下来,2016-12-01 15:10:42,3,0
356060330,颜色分类:010黑色Black;尺码:170/88A/L,最***7,293581092161,感觉充绒量真的好少、好单薄、毛领也没图片大,2016-11-27 14:04:24,2,0
356060330,颜色分类:010黑色Black;尺码:170/88A/L,蓝***7,296935891301,缝线的地方跑毛,2016-12-24 12:43:41,3,0
356060330,颜色分类:010黑色Black;尺码:175/92A/XL,x***3,292807456415,穿起来很合体大方，有点瑕疵，客服也给顺利解决了，会推荐给朋友买的,2016-11-20 23:17:07,2,0
356060330,颜色分类:010黑色Black;尺码:165/84A/M,呵***呵,292884591322,衣服很好，上身漂亮，穿着合适,2016-11-23 10:34:32,3,0
356060330,颜色分类:010黑色Black;尺码:175/96A/XXL,t***2,292203075437,尺码很准，很对宝贝非常满意，11号下的订单，十二号就到家啦！但是对于快递真的是不敢恭维，拍的宝贝分了三个包裹，第一个包裹，ems送来的时候直接打电话让我下去拿，还振振有词的说ems都这样！第二单，居然送错了地方，好心的邻居给我打电话，我自己去人家取的，无语了，暴力快递对我质疑不送上楼的报复吗？但是支持店家，宝贝仍然五星好评，建议换掉快递公司。,2016-11-16 16:39:11,4,0
356060330,颜色分类:126沙色GRAY SAND;尺码:165/84A/M,于***5,294977142498,色差很严重啊！,2016-12-07 18:17:26,3,0
356060330,颜色分类:126沙色GRAY SAND;尺码:165/84A/M,哈***0,293005086570,号码正常，我114斤，164，穿l号正好，很静雅时尚，喜欢！！！支持only,2016-11-23 15:25:43,3,0
356060330,颜色分类:010黑色Black;尺码:165/84A/M,晴***8,295527022368,衣服很好，只不过我身高一米六八的，我体重一百三穿这个号有点小，要等到过一段时间再穿。努力减肥。,2016-12-14 10:39:54,3,0
356060330,颜色分类:010黑色Black;尺码:165/84A/M,l***s,292213586410,长度非常喜欢 码子刚好合适。这件衣服好像专推线上 那天去店里有一件差不多的 但也不是，好像不推线下 不过总体而言挺不错,2016-11-18 17:38:40,2,0
356060330,颜色分类:126沙色GRAY SAND;尺码:170/88A/L,大***藻,291863574350,165，65kg，穿着略宽，到小腿，显瘦，质量超好，满意,2016-11-16 22:40:44,3,1
356060330,颜色分类:010黑色Black;尺码:175/92A/XL,2***光,292313520676,终于收到了，真不容易啊！花了整整6天时间，快递才到，不过双十一可以理解，衣服没有想象那么厚，但是还是很漂亮的，毛也很好看，整体还是很满意的。,2016-11-17 17:37:41,0,0
356060330,颜色分类:126沙色GRAY SAND;尺码:170/88A/L,妖***8,294568905225,性价比不错，物流不敢相信。唯一缺陷拉链设计不好。总体还不错,2016-12-07 14:19:50,3,0
356060330,颜色分类:010黑色Black;尺码:160/80A/S,l***1,293670855254,性价比很高的一款羽绒服 双十一买的 不到一千块 很满意,2016-11-27 22:14:31,2,0
356060330,颜色分类:126沙色GRAY SAND;尺码:170/88A/L,l***4,292782373700,<b></b>此<b></b>用<b></b>户<b></b>没<b></b>有<b></b>填<b></b>写<b></b>评<b></b>论<b></b>!<b></b>,2016-11-22 17:17:00,4,0
356060330,颜色分类:010黑色Black;尺码:160/80A/S,t***7,292236464588,整体不错，但双十一过后还是这个价......而且是哑光色的，没有实体店那么亮，腰带也不一样，大家都在想是不是同一款。,2016-11-17 08:12:15,2,0
356060330,颜色分类:126沙色GRAY SAND;尺码:165/84A/M,c***g,292937588406,很不错 双十一买到最满意的了 毕竟价格就在那儿嘛 也便宜了不少呢,2016-11-22 17:15:25,2,0
356060330,颜色分类:010黑色Black;尺码:165/84A/M,r***3,293858270728,双11很优惠，两件才1500，超值哈哈，信赖的品牌，这件还没穿，试了下到脚，保暖,2016-11-30 10:39:49,4,0
356060330,颜色分类:126沙色GRAY SAND;尺码:160/80A/S,张***2,295189761603,评价晚了，不好意思，大气，时尚，羽绒服还这么修身，最重要的是真的好暖和,2016-12-12 12:25:36,2,0
356060330,颜色分类:126沙色GRAY SAND;尺码:160/80A/S,w***9,291934604630,挺不错，163 50s码，不紧还能穿厚毛衣，拿这羽绒服黑龙江过冬，妈妈再也不担心我冷了,2016-11-17 12:58:30,2,0
356060330,颜色分类:126沙色GRAY SAND;尺码:170/88A/L,拇***笑,293149169752,挺修身的衣服 挺厚实的 毛领有点掉毛,2016-11-24 18:38:37,3,0
356060330,颜色分类:126沙色GRAY SAND;尺码:165/84A/M,羽***飞,298125975419,整容僵尸脸太毁了！恶心！不再看她的表演 有她出现快进！,2017-01-05 15:14:00,2,0
356060330,颜色分类:126沙色GRAY SAND;尺码:165/84A/M,m***4,295527551451,<b></b>此<b></b>用<b></b>户<b></b>没<b></b>有<b></b>填<b></b>写<b></b>评<b></b>论<b></b>!<b></b>,2016-12-08 14:56:06,0,0
356060330,颜色分类:010黑色Black;尺码:165/84A/M,e***g,293660158143,很厚很暖，就是好长啊~~我1米64，到小腿肚了。,2016-11-28 14:25:52,2,0
356060330,颜色分类:010黑色Black;尺码:160/80A/S,y***o,293314447828,衣服很好，有点长，160，穿着到小腿那里，不过很暖和,2016-11-27 15:12:39,2,0
356060330,颜色分类:126沙色GRAY SAND;尺码:170/88A/L,王***儒,295953581629,样子好看，就是拉链那里有点瑕疵好像，又或者是就那样的样子，问客服不太搭理人，算了，就这样吧。,2016-12-16 16:47:06,2,0
356060330,颜色分类:126沙色GRAY SAND;尺码:160/80A/S,d***8,295126551462,"衣服不错，158cm,58公斤，换了大一码。",2016-12-10 21:08:15,3,0
356060330,颜色分类:126沙色GRAY SAND;尺码:170/88A/L,楚***赜,293934188356,124斤，170高，170号，里面穿的休闲毛衣，胖瘦刚刚好,2016-12-01 13:31:50,3,0
356060330,颜色分类:126沙色GRAY SAND;尺码:170/88A/L,t***2,293640284431,售后太慢 这种速度以后怎么来买阿 希望赶快给处理,2016-11-29 20:34:01,3,0
356060330,颜色分类:010黑色Black;尺码:175/92A/XL,t***1,292490479604,面料还行吧 感觉有点薄 暂时还没有发现,2016-11-21 08:38:21,2,0
356060330,颜色分类:126沙色GRAY SAND;尺码:165/84A/M,l***新,292757207640,衣服质量很好，样子很时尚，值得购买，双十一买的超级值?客服服务态度特别好，有点小插曲解决的很满意,2016-11-21 12:28:11,0,0
356060330,颜色分类:010黑色Black;尺码:165/84A/M,刘***m,294910754245,很满意的一次购物，衣服质量好，绒也多，穿起来保暖,2016-12-10 11:38:11,3,0
356060330,颜色分类:126沙色GRAY SAND;尺码:160/80A/S,s***8,293322029412,衣服挺好，就是有些跑毛～,2016-11-24 23:35:31,3,0
356060330,颜色分类:126沙色GRAY SAND;尺码:155/76A/XS,女***糖,294065484649,还可以,2016-12-02 23:55:20,0,1
356060330,颜色分类:126沙色GRAY SAND;尺码:165/84A/M,z***8,293126406767,好看，舒适，很厚，双十一买很划算,2016-11-22 21:20:19,4,0
356060330,颜色分类:126沙色GRAY SAND;尺码:160/80A/S,艾***远,292881311075,不错，挺满意。,2016-11-23 13:46:00,3,2
356060330,颜色分类:010黑色Black;尺码:175/92A/XL,q***o,296113101701,衣服很大气，很长，都到小腿了，值得拥有。,2016-12-17 22:39:29,3,0
356060330,颜色分类:126沙色GRAY SAND;尺码:165/84A/M,h***5,297352013219,物流好快，头天下午拍第二天早上到。衣服跟实体店一样，价格还划算,2016-12-28 21:05:50,2,0
356060330,颜色分类:010黑色Black;尺码:165/84A/M,女***涵,291833086216,衣服特别好，和蒙口的牌子差不多，虽然料子不一样，可是穿上也好大牌，就是武清友谊实体店的店员服务态度不好，只能再网上买，网上的服务态度超级赞,2016-11-15 11:22:32,0,0
356060330,颜色分类:126沙色GRAY SAND;尺码:160/80A/S,q***7,292012834451,整体挺满意，感觉还是168以上个高的穿比较好看。偏大。166，60公斤穿160s码竟然正好，里面还套了厚毛衣，幸亏没拍165的,2016-11-17 13:10:15,3,0
356060330,颜色分类:010黑色Black;尺码:160/80A/S,z***j,292265552391,尺码合适，版型不错，不算厚，毛领子没有模特身上的效果好。超值！！！,2016-11-16 22:50:25,3,0
356060330,颜色分类:010黑色Black;尺码:165/84A/M,z***5,292602563761,质量很好 物超所值 领口 袖口做的很保暖 再加上腰带 冬天应该很暖和 可以放心购买 希望卖家多生产几种颜色 还想再买一件,2016-11-19 14:54:07,3,0
356060330,颜色分类:126沙色GRAY SAND;尺码:165/84A/M,l***喔,295315778725,衣服穿上大气又特别 这个价钱买到简直太值了,2016-12-13 23:22:16,0,0
356060330,颜色分类:126沙色GRAY SAND;尺码:165/84A/M,水***8,298312843748,特别有型，厚实，物有所值,2017-01-08 09:33:39,0,0
356060330,颜色分类:126沙色GRAY SAND;尺码:160/80A/S,t***5,293333814101,穿了两天，里面的羽毛会跑出来,2016-11-27 11:41:24,0,0
356060330,颜色分类:010黑色Black;尺码:155/76A/XS,小***布,294341073794,挺合算的，很长，也很保暖，收腰的设计也很显瘦,2016-12-03 18:34:00,3,0
356060330,颜色分类:010黑色Black;尺码:175/92A/XL,a***e,292486422304,<b></b>此<b></b>用<b></b>户<b></b>没<b></b>有<b></b>填<b></b>写<b></b>评<b></b>论<b></b>!<b></b>,2016-11-21 09:11:23,4,0
356060330,颜色分类:126沙色GRAY SAND;尺码:160/80A/S,周***z,295369976226,衣服胸前有一块一块的蓝色痕迹，不仔细看不出来！我167穿M号的都快到脚踝了，下面的拉链不拉开根本没法走路！客服每次回复超级慢，每次都要等上半个甚至一个小时才说上一句话！而且！！我双十一买的only家一件衣服，等了半个月不发货，跟我说衣服有质量问题让我退款！可我买的L号明明还能拍下，说明还有库存，问客服为何不发货，客服一直让退货，没给出任何合理的解释！错过了双十一的优惠活动，还让我白白等了大半个月，从秋天等到冬天！！而且客服回复态度超级差！,2016-12-13 23:52:44,3,0
356060330,颜色分类:010黑色Black;尺码:165/84A/M,西***烟,292525808608,羽绒服是那种滑滑的料子感觉穿的时候有点小，腰带的位置太高啦！我的妈呀！么那条好看多啦！,2016-11-19 01:09:21,4,0
356060330,颜色分类:126沙色GRAY SAND;尺码:165/84A/M,索***艺,293676668192,很好很喜欢,2016-11-29 12:29:18,3,1
356060330,颜色分类:126沙色GRAY SAND;尺码:160/80A/S,华***石,292177377875,是正品 穿起来也挺好看的 面料也不是那种爱脏的面料 大概到小腿肚子下面 我161，103斤，穿s码刚好 不要皮带也好看的 总之很喜欢,2016-11-18 07:02:35,2,0
356060330,颜色分类:126沙色GRAY SAND;尺码:165/84A/M,凯***恩,298576640169,167，110斤。M刚好。质量挺好的。折后980。,2017-01-08 19:16:24,0,0
356060330,颜色分类:010黑色Black;尺码:160/80A/S,d***0,292697445198,本来想买另一件的，没有抢到，质量还可以，就是要钻毛,2016-11-21 13:02:38,2,0
356060330,颜色分类:126沙色GRAY SAND;尺码:160/80A/S,暖***t,294420521797,还可以，除了大家反应的拉链问题，还有，迈不开步呀，下面这个设计真是醉了，是缺布料吗！！！,2016-12-02 18:17:15,3,0
356060330,颜色分类:126沙色GRAY SAND;尺码:170/88A/L,空***1,296133284527,我170穿上到脚裸，质量不错，就是太长了！,2016-12-18 16:09:40,0,0
356060330,颜色分类:010黑色Black;尺码:155/76A/XS,j***6,293190707967,衣服特意比平时小买了一号，超级修身的，所有人都说超值&hellip;&hellip;,2016-11-24 00:03:22,3,0
356060330,颜色分类:010黑色Black;尺码:160/80A/S,y***a,292724835004,挺好看的，高腰腰带，脖子以下全是腿的既视感,2016-11-22 19:40:56,4,0
356060330,颜色分类:126沙色GRAY SAND;尺码:165/84A/M,硬***子,292351653040,双十一剁手收到的第一件，开心，打开后发现更开心，衣服颜色美美的，而且很长很保暖，等过几天更冷点就可以穿啦,2016-11-19 10:29:57,3,0
356060330,颜色分类:126沙色GRAY SAND;尺码:175/92A/XL,j***i,295883255477,超级美的衣服，特别显气质,2016-12-16 14:29:28,3,0
356060330,颜色分类:126沙色GRAY SAND;尺码:160/80A/S,苏***u,291842296188,<b></b>此<b></b>用<b></b>户<b></b>没<b></b>有<b></b>填<b></b>写<b></b>评<b></b>论<b></b>!<b></b>,2016-11-15 16:20:04,0,0
356060330,颜色分类:010黑色Black;尺码:165/84A/M,m***8,291908947076,真的很薄 衣柜里任何一件羽绒服都比它厚啊 这件衣服不知道能不能抵御今年的寒冬 如果不是因为样式喜欢 就直接退了,2016-11-17 10:15:11,3,0
356060330,颜色分类:126沙色GRAY SAND;尺码:170/88A/L,张***5,292528817494,衣服很保暖，漂亮，做工精细，样式新颍，特别是帽子上的毛毛很密,2016-11-19 19:59:41,3,0
356060330,颜色分类:126沙色GRAY SAND;尺码:165/84A/M,果***样,293764096214,没有想象中的颜色漂亮，也凑活，价格便宜，值得购买,2016-11-28 00:10:36,4,0
356060330,颜色分类:010黑色Black;尺码:170/88A/L,春***歌,293150067456,挺好双十一很便宜，质量也好，毛领好！,2016-11-23 08:05:43,0,0
356060330,颜色分类:126沙色GRAY SAND;尺码:170/88A/L,贺***颖,293198756043,还是很满意的，拉链总觉得不是很耐用，穿上很暖和，挺值得,2016-11-24 10:03:02,2,0
356060330,颜色分类:126沙色GRAY SAND;尺码:170/88A/L,和***2,296947091603,质量真好 不愧大牌子！虽然有点长 但也留下了,2016-12-25 10:01:52,0,0
356060330,颜色分类:126沙色GRAY SAND;尺码:165/84A/M,我***宝,292693282307,太长了，撑不起来，但东西很好，被同事相中了！半夜起来帮闺蜜抢件衣服！,2016-11-21 21:00:56,3,0
356060330,颜色分类:010黑色Black;尺码:160/80A/S,洋***洋,292888201650,东西收到了，非常好看，而且保暖合身，我165，103斤，穿S码，供参考,2016-11-21 09:27:34,2,0
356060330,颜色分类:010黑色Black;尺码:165/84A/M,杜***紫,294344293314,衣服很薄，特别是下摆,2016-12-03 22:40:04,3,0
356060330,颜色分类:126沙色GRAY SAND;尺码:170/88A/L,张***2,293601460745,厚实，漂亮，999太值了,2016-11-28 10:18:47,3,0
356060330,颜色分类:126沙色GRAY SAND;尺码:160/80A/S,y***o,296524776809,衣服美美哒，保暖性超强，价格很实惠！,2016-12-23 10:18:49,0,0
356060330,颜色分类:010黑色Black;尺码:165/84A/M,b***1,297335120295,质量不错！就是有点薄,2016-12-28 11:44:19,3,0
356060330,颜色分类:126沙色GRAY SAND;尺码:165/84A/M,i***非,294854940954,人见人夸的羽绒服，超爱的狐狸毛领，颜色虽然浅但很耐脏,2016-12-06 13:37:55,3,0
356060330,颜色分类:010黑色Black;尺码:165/84A/M,s***3,294554236837,衣服挺长的，双十一买的，价格合适,2016-12-03 21:09:12,3,0
356060330,颜色分类:010黑色Black;尺码:170/88A/L,思***c,293437538616,衣服收到了，不错，和实体店是一样的质量，喜欢，以后还会来的 ?,2016-11-28 09:00:04,0,0
356060330,颜色分类:010黑色Black;尺码:165/84A/M,t***1,292075210345,本来想大一码，但是晚上睡过啦，抢的正好的码数，来啦也正好，很好看，黑色也耐脏，很喜欢,2016-11-16 10:50:06,3,0
356060330,颜色分类:010黑色Black;尺码:175/92A/XL,静***9,297175066491,<b></b>此<b></b>用<b></b>户<b></b>没<b></b>有<b></b>填<b></b>写<b></b>评<b></b>论<b></b>!<b></b>,2016-12-12 22:19:08,0,0
356060330,颜色分类:126沙色GRAY SAND;尺码:155/76A/XS,s***0,293949975950,很长很保暖 一件衣服就可以过冬了,2016-11-30 18:16:13,0,0
356060330,颜色分类:126沙色GRAY SAND;尺码:170/88A/L,t***6,292882298307,质量超好，而且做工细节都非常好呢，全5分。,2016-11-21 16:57:01,3,0
356060330,颜色分类:010黑色Black;尺码:165/84A/M,s***l,294154714304,显瘦，跑毛，有点影响迈腿,2016-12-01 12:09:01,2,0
356060330,颜色分类:126沙色GRAY SAND;尺码:155/76A/XS,t***4,291621448532,我只想说，实在太超值了！999入手双十一券后价，质量超级好，东北穿这个也可以任性的玩耍了。还好买到了，哈哈哈现在看已经没有货了啊,2016-11-14 11:23:24,3,0
356060330,颜色分类:010黑色Black;尺码:175/92A/XL,r***n,295114767531,充绒量没那么高 特薄,2016-12-12 10:04:35,3,0
356060330,颜色分类:010黑色Black;尺码:165/84A/M,就***锅,293717247592,白色黑色都入手,2016-11-29 19:56:34,2,0
356060330,颜色分类:010黑色Black;尺码:165/84A/M,彬***2,292242564433,很大很厚实，稍微有点长，在店里试过类似的款，165稍微有点儿小，170稍微有点大，双十一买的165，很划算,2016-11-17 20:36:05,3,0
356060330,颜色分类:010黑色Black;尺码:160/80A/S,a***0,292864686173,还行，有点老气，但是物流十分单位,2016-11-22 10:16:48,2,0
356060330,颜色分类:126沙色GRAY SAND;尺码:165/84A/M,五***生,292169523685,老婆穿了感觉有点薄，颜色她不是太喜欢，不过我觉着挺耐看的。,2016-11-16 18:48:19,3,0
