356060330,颜色分类:010黑;尺码:155/76A/XS,s***2,286563510207,感觉质量不怎么样，不像正品，显胖,2016-10-01 20:28:37,3,0
356060330,颜色分类:043军绿;尺码:170/88A/L,为***i,286922164333,挺宽松的 就是袖子部分的设计有点紧 整天不错 好评！,2016-10-02 21:17:52,3,0
356060330,颜色分类:010黑;尺码:165/84A/M,佳***r,286024355266,袖子很紧，没有弹力。其他地方有弹力，肥度也够。,2016-09-22 12:23:41,0,0
356060330,颜色分类:010黑;尺码:165/84A/M,我***6,292580929114,一如既往的好,2016-11-20 08:27:32,3,0
356060330,颜色分类:010黑;尺码:170/88A/L,莒***1,292538634072,一如既往的好,2016-11-19 08:25:34,2,0
356060330,颜色分类:010黑;尺码:160/80A/S,l***4,286322837484,衣服可以买平时小一号，宽松型，但是好看,2016-09-28 14:42:13,3,0
356060330,颜色分类:010黑;尺码:160/80A/S,c***r,288094138852,很好看，很喜欢,2016-10-13 21:53:10,3,0
356060330,颜色分类:043军绿;尺码:170/88A/L,陈***博,284884743575,像我这种微胖的人穿起来还是显得更胖的。没有毛豆这么拽。不过总体讲我挺满意。胳膊粗，小肚子大这些缺点都给我盖住啦。衣服有些味道。毛的质量略显粗糙。和图片是一毛一样滴。无色差。总体还是满意滴。,2016-09-12 19:16:35,2,0
356060330,颜色分类:010黑;尺码:170/88A/L,1***6,289543295052,非常喜欢，显瘦，物流也很快,2016-10-28 13:45:37,3,0
356060330,颜色分类:010黑;尺码:155/76A/XS,s***7,287682067112,满意，是正品,2016-10-12 15:26:35,3,0
356060330,颜色分类:010黑;尺码:165/84A/M,双***照,285301411396,质量不错，第一次洗水有些掉色，其他都好。版型显瘦，我身高160，体重124，穿起来很显瘦，非常遮肚子。颜色略单调，需要搭配一条别致的毛衣项链。整体不错，满意！,2016-09-15 08:54:38,3,0
356060330,颜色分类:010黑;尺码:165/84A/M,蜕***8,289658267434,很好，喜欢。,2016-10-28 21:45:23,3,0
356060330,颜色分类:010黑;尺码:155/76A/XS,文***6,287718875310,挺好的，喜欢,2016-10-10 23:51:15,3,0
356060330,颜色分类:010黑;尺码:165/84A/M,丫***5,286104104198,很简单的一个黑色毛衣、就只有袖子那开口设计、穿起来好像没有图片那么好、就用来当打底的吧、,2016-09-25 11:52:25,0,2
356060330,颜色分类:010黑;尺码:160/80A/S,陈***7,285135776311,这衣服设计我也是醉了，衣服宽松的要死，袖子紧的要命，我的手臂都够瘦了穿上还是勒的不舒服，不知道会不会褪色，应该要起球 ！,2016-09-13 15:46:27,3,0
356060330,颜色分类:043军绿;尺码:160/80A/S,t***8,286669498946,衣服很漂亮，料子摸着特别舒服，整体很宽松，就是袖子有点紧。可能是我本来就买的小一码的原因吧。但是衣服还是很不错的。,2016-09-30 14:26:41,2,1
356060330,颜色分类:010黑;尺码:170/88A/L,疏***雪,284236471077,本来想换的，领口一圈白色的污渍，不知道是不是别人穿过的，留下粉底液？太恶心。在这家买了很多了，这次最隔应。太麻烦不换了，自己洗了。希望卖家长点心，收到别人的退货好好检查一下，也别给发这样的货了。衣服很长，做裙子长度很够，完全没问题。就是喜欢这样简洁的款,2016-09-05 09:56:13,4,0
356060330,颜色分类:010黑;尺码:160/80A/S,t***2,285849883873,袖口有点紧。整体不错  165 120斤。孕8个月啦 要是孕妈可以再买大一号的,2016-09-23 22:21:51,2,1
356060330,颜色分类:010黑;尺码:170/88A/L,原***過,286299167883,一眼就看中的，然后直接买下了。貌似会掉毛，因为对毛毛过敏，这衣服拿在手里鼻子就难受，不知道洗了以后会不会好点,2016-09-29 09:52:02,2,0
356060330,颜色分类:010黑;尺码:155/76A/XS,金***7,287520131913,幸好没有听客服的，买了比平时穿的小一号的。袖子正好，身体特别宽，比模特身上的效果宽松，属于宽松版的，上身效果一般，不是特别好看，当打底衣穿，希望以后穿了不要掉色严重。衣服还算满意，就是邮费掏的有点冤,2016-10-07 21:15:08,0,0
356060330,颜色分类:010黑;尺码:155/76A/XS,宝***屁,284337194291,挺好的，买的最小号，刚好合适，^_^已经洗了有点掉色，然后宿舍没有醋啊，就只用了金纺，希望能保护好点,2016-09-06 09:43:37,2,0
356060330,颜色分类:010黑;尺码:175/92A/XL,t***2,284921262374,较厚，棉线的厚针织衫，宽松版。感觉设计有点小问题，胸围合适的手臂紧到勒肉，大一号的身体很宽，手臂刚好。不过穿上倒是好看。,2016-09-13 14:47:09,4,0
356060330,颜色分类:010黑;尺码:155/76A/XS,z***8,286289114441,质量很差，搞得跟孕妇装一样，一洗全掉毛，大家看清楚了再买吧！,2016-09-25 20:06:26,3,0
356060330,颜色分类:043军绿;尺码:160/80A/S,花***逝,284456720198,<b></b>此<b></b>用<b></b>户<b></b>没<b></b>有<b></b>填<b></b>写<b></b>评<b></b>论<b></b>!<b></b>,2016-09-05 21:24:11,0,0
356060330,颜色分类:010黑;尺码:170/88A/L,r***姐,291659965507,静静等待包包,2016-11-13 13:44:50,3,1
356060330,颜色分类:010黑;尺码:165/84A/M,佑***6,285969814339,穿起来感觉特别大，腰和肚子这里还可以再塞一个人，肩膀和手臂又很合身，感觉有点显胖,2016-09-26 00:42:49,4,0
356060330,颜色分类:010黑;尺码:165/84A/M,双***照,285301411396,质量不错，第一次洗水有些掉色，其他都好。版型显瘦，我身高160，体重124，穿起来很显瘦，非常遮肚子。颜色略单调，需要搭配一条别致的毛衣项链。整体不错，满意！,2016-09-15 08:54:38,3,0
356060330,颜色分类:043军绿;尺码:175/92A/XL,飞***1,286119424080,一直都很喜欢你们家的衣服，也是你们家的忠实顾客，只是第一次在网上购买，和店里没有什么区别，很好的。,2016-09-23 10:51:08,0,0
356060330,颜色分类:043军绿;尺码:165/84A/M,好***赫,290317249420,还可以，喜欢,2016-11-02 20:32:43,3,0
356060330,颜色分类:010黑;尺码:165/84A/M,c***r,289916487501,还没拆封，囤货中,2016-10-30 12:16:34,4,0
356060330,颜色分类:010黑;尺码:170/88A/L,你***薇,288129448976,实物相符 但是不洗的话会有黑色浮毛,2016-10-15 15:13:54,2,0
356060330,颜色分类:010黑;尺码:155/76A/XS,q***3,288281955509,一直是only家的铁粉，衣服一如既往的漂亮合身，朋友都说好漂亮！,2016-10-14 09:12:52,0,0
356060330,颜色分类:010黑;尺码:160/80A/S,t***2,288443566146,很好，价格也便宜！,2016-10-17 11:54:02,3,1
356060330,颜色分类:010黑;尺码:160/80A/S,l***n,292077728130,买三件送包，包呢？,2016-11-15 18:37:23,2,0
356060330,颜色分类:010黑;尺码:155/76A/XS,梦***n,286054103032,XS 颜色看起来好旧，就像好几年的存货，其他一般般。,2016-09-23 11:29:58,0,0
356060330,颜色分类:010黑;尺码:160/80A/S,陈***7,285135776311,这衣服设计我也是醉了，衣服宽松的要死，袖子紧的要命，我的手臂都够瘦了穿上还是勒的不舒服，不知道会不会褪色，应该要起球 ！,2016-09-13 15:46:27,3,0
356060330,颜色分类:010黑;尺码:165/84A/M,8***淘,287493849978,领子袖子较紧，身子大。建议买平时的码子，本人163，119斤,2016-10-06 22:13:43,3,0
356060330,颜色分类:010黑;尺码:165/84A/M,e***n,286440809737,老公说穿上很漂亮，很性感。,2016-09-26 11:35:56,3,0
356060330,颜色分类:010黑;尺码:170/88A/L,心***1,286461375537,很厚实的一件毛衣裙。92cm胸围，选的l码，胸围大小及手臂大小都合适。,2016-09-29 21:59:53,0,0
356060330,颜色分类:010黑;尺码:165/84A/M,春***丫,284645629275,第一次收到衣服，正面有线头，发货去换，运费垫付不说，衣服根本没换，把正面那个线头藏到里面去了，忽悠了事。再次找客户，又让我发回去再换。你们发货的时候不检查吗？第一次是不仔细，那第二次算什么呢？垫付的物流费答应退，这会儿也不退。只能说店大欺客。,2016-09-09 11:00:14,3,0
356060330,颜色分类:010黑;尺码:160/80A/S,h***e,288539268506,袖口有点紧，其他还行，穿不出来模特的感觉,2016-10-18 08:50:31,2,0
356060330,颜色分类:010黑;尺码:155/76A/XS,t***8,287689427412,有点长，不像模特这样我穿大概到膝盖上一点点，但穿高跟鞋的话还好吧？,2016-10-08 19:55:08,0,0
356060330,颜色分类:043军绿;尺码:165/84A/M,玉***乖,288844589193,毛衣线比较粗 不过上身效果很好 很宽松,2016-10-19 09:45:18,4,0
356060330,颜色分类:010黑;尺码:160/80A/S,白***4,287438199501,不错，很满意的一次购物！包装很精致，又是盒子又是袋子的，跟实体店一样,2016-10-07 22:49:17,0,0
356060330,颜色分类:010黑;尺码:155/76A/XS,瑜***姐,286438672425,款式不错，但是感觉不值这个价。买过的人心里明白。,2016-09-26 22:26:53,3,0
356060330,颜色分类:010黑;尺码:155/76A/XS,a***1,286564827279,衣服上面好多毛，质量还可以，不知道会不会很粘毛,2016-09-30 09:53:01,3,0
356060330,颜色分类:010黑;尺码:170/88A/L,王***9,286572465153,建议买小一码 我买的平时码 简直太肥了 就当休闲穿吧,2016-09-29 11:33:11,3,0
356060330,颜色分类:010黑;尺码:160/80A/S,糖***8,288981764260,毛衣很厚实，样子也独特，可是没有XS，S穿着有些大！,2016-10-21 18:42:16,3,0
356060330,颜色分类:010黑;尺码:155/76A/XS,非***7,286642545656,款式不错、虽然材质不咋地，就是个线织的。穿个款式吧,2016-09-30 23:03:18,3,0
356060330,颜色分类:010黑;尺码:160/80A/S,z***8,286673844595,手感不错，有一点掉毛。,2016-09-30 15:05:28,3,0
356060330,颜色分类:010黑;尺码:155/76A/XS,香***氧,285901688690,将就用，质量不是很好，也不是很差，跟价格匹配,2016-09-24 13:56:44,0,0
356060330,颜色分类:010黑;尺码:165/84A/M,丁***4,282687520132,上身挺好看的，服务也特别好，下次需要还会再来的，喜欢的亲快下手吧,2016-08-18 12:47:43,2,0
356060330,颜色分类:010黑;尺码:160/80A/S,小***1,286232480429,衣服挺好，袖子有点紧，其他都好,2016-09-24 22:20:36,4,0
356060330,颜色分类:010黑;尺码:170/88A/L,海***飞,288381828143,商品很棒。裙子尤其好。就是不明白为什么 二件衣衣分二个物流送。发货地址是一样的。感觉好浪费呀。,2016-10-16 08:31:19,3,0
356060330,颜色分类:010黑;尺码:170/88A/L,邹***y,287147382565,这个配长筒靴，美美嗒！适合个高肤白的女生，个儿矮了，会显胖,2016-10-03 12:28:22,3,0
356060330,颜色分类:010黑;尺码:165/84A/M,劇***7,290332194821,质量很好，值得购买,2016-11-04 21:21:15,3,0
356060330,颜色分类:010黑;尺码:165/84A/M,梦***花,287485283016,还不错吧，感觉穿完了显的肩膀很宽 我是大骨架的人,2016-10-10 18:27:31,3,0
356060330,颜色分类:010黑;尺码:165/84A/M,李***p,287088439142,这毛衣一直让我有种穿反了的感觉，前边领子割脖子,2016-10-03 17:31:12,4,0
356060330,颜色分类:010黑;尺码:160/80A/S,晓***阳,286857197011,164 53 身上宽松合适 胳膊有点紧,2016-09-30 15:48:20,3,0
356060330,颜色分类:043军绿;尺码:165/84A/M,我***5,286970113343,这衣服一到，就试穿了一下，上身效果不错,2016-10-03 16:44:16,0,0
356060330,颜色分类:010黑;尺码:160/80A/S,猫***代,288093504879,感觉平时穿什么码就买什么码比较好，否则胳膊会很嘞，显得很膀,2016-10-13 10:15:24,0,0
356060330,颜色分类:010黑;尺码:160/80A/S,4***a,286510270582,没有想象中的好看，感觉洗过后会变大,2016-09-29 10:23:50,3,0
356060330,颜色分类:010黑;尺码:155/76A/XS,静***4,287493504270,衣服挺好看，就是发回来衣服上好多灰，像旧货一样,2016-10-07 07:47:34,2,0
356060330,颜色分类:010黑;尺码:155/76A/XS,凌***t,286824894738,衣服很好看，因为我矮所以很长，挺厚的。,2016-10-02 17:20:40,3,0
356060330,颜色分类:010黑;尺码:155/76A/XS,谭***l,286361623262,很不错哟，老公说这是他看我网购最好的一件了,2016-09-26 14:31:37,2,0
356060330,颜色分类:010黑;尺码:170/88A/L,t***0,288516761961,一般，胳膊那会冷吧，凑合穿吧，一般般,2016-10-16 11:49:52,3,0
356060330,颜色分类:010黑;尺码:160/80A/S,流***1,287889833529,衣服挺好的，穿上也好看～非常喜欢,2016-10-14 13:38:44,2,0
356060330,颜色分类:010黑;尺码:170/88A/L,疏***雪,284236471077,本来想换的，领口一圈白色的污渍，不知道是不是别人穿过的，留下粉底液？太恶心。在这家买了很多了，这次最隔应。太麻烦不换了，自己洗了。希望卖家长点心，收到别人的退货好好检查一下，也别给发这样的货了。衣服很长，做裙子长度很够，完全没问题。就是喜欢这样简洁的款,2016-09-05 09:56:13,4,0
356060330,颜色分类:010黑;尺码:160/80A/S,沁***娃,286325507669,试过啦！希望冬天能穿好看不冷。,2016-09-25 21:25:12,3,0
356060330,颜色分类:010黑;尺码:170/88A/L,连***珑,287100192158,很厚很重 舒适度一般般,2016-10-02 20:41:20,4,0
356060330,颜色分类:010黑;尺码:155/76A/XS,晓***欣,286218184863,款式不错，就是太宽大了,2016-09-27 15:17:15,2,0
356060330,颜色分类:043军绿;尺码:170/88A/L,阿***9,286485696378,总在商场买，第一次在这买，穿上大小合适，满意,2016-09-26 20:05:25,2,0
356060330,颜色分类:010黑;尺码:165/84A/M,放***烟,287262569790,媳妇说有点大，质量挺好的,2016-10-04 15:24:45,3,0
356060330,颜色分类:010黑;尺码:165/84A/M,t***1,286020270720,不是想象中的样子，颜色发白.旧旧的看着,2016-09-24 17:28:44,0,0
356060330,颜色分类:010黑;尺码:165/84A/M,c***6,288613260783,质量没有想象的好，感觉这个价钱不太值,2016-10-20 20:49:05,3,0
356060330,颜色分类:010黑;尺码:170/88A/L,彼***n,286003588008,挺好的   物流快   服务好就是回复慢   人多吧,2016-09-23 00:06:02,0,0
356060330,颜色分类:010黑;尺码:170/88A/L,1***6,289543295052,非常喜欢，显瘦，物流也很快,2016-10-28 13:45:37,3,0
356060330,颜色分类:043军绿;尺码:170/88A/L,r***5,286870748447,好看，显白显瘦,2016-10-04 22:55:49,0,0
356060330,颜色分类:010黑;尺码:165/84A/M,蜕***8,289658267434,很好，喜欢。,2016-10-28 21:45:23,3,0
356060330,颜色分类:010黑;尺码:170/88A/L,小***9,287344343592,衣服到手感觉好大呀！穿上很好看。,2016-10-07 09:01:42,0,0
356060330,颜色分类:010黑;尺码:165/84A/M,愛***1,287344530147,袖子有点紧，其他都挺好的！,2016-10-07 21:01:55,4,0
356060330,颜色分类:010黑;尺码:160/80A/S,暮***昏,287991867226,款式一般般、有点旧旧的样子,2016-10-13 20:38:04,3,0
356060330,颜色分类:010黑;尺码:165/84A/M,q***3,286023424781,质量特别好。。穿出来可有气质了。。,2016-09-23 08:14:03,0,0
356060330,颜色分类:010黑;尺码:160/80A/S,l***璇,287603639640,衣服刚好，漂亮,2016-10-09 13:24:01,0,0
356060330,颜色分类:010黑;尺码:165/84A/M,o***9,287339032222,only的衣服码子最合身了，超级喜欢！,2016-10-08 00:06:07,3,0
356060330,颜色分类:043军绿;尺码:170/88A/L,我***咖,287625758591,还可以啊穿着也挺舒服,2016-10-10 08:34:34,3,0
356060330,颜色分类:010黑;尺码:170/88A/L,l***e,283763015217,刚收到就看见有点饭渍，感觉像别人穿过一样。穿着有点长，宽松，孕期就这样将就吧，懒得换了，希望以后卖家注意。,2016-08-31 13:55:07,3,2
356060330,颜色分类:010黑;尺码:170/88A/L,z***0,287522585401,很好看～～穿着也不错,2016-10-11 07:10:21,0,0
356060330,颜色分类:010黑;尺码:155/76A/XS,t***6,286838738508,款式可以，不过呢，就是再短点就更好看了,2016-10-03 14:11:31,3,0
356060330,颜色分类:010黑;尺码:175/92A/XL,陌***开,286375623424,尺码：尺码合适，袖子有点紧。,2016-09-27 10:15:04,4,0
356060330,颜色分类:010黑;尺码:160/80A/S,s***0,287962203205,还不错，穿着挺好看的，以后还会来买的,2016-10-13 16:05:01,3,0
356060330,颜色分类:010黑;尺码:165/84A/M,帝***天,283562780950,想显身材的慎拍，宽松的版型，最好拍比平时小一码,2016-08-28 10:11:25,0,2
356060330,颜色分类:010黑;尺码:160/80A/S,k***1,286254565698,不错的一次购物，宝贝棒棒的。,2016-09-27 21:12:45,3,0
356060330,颜色分类:010黑;尺码:165/84A/M,s***2,286570384861,好看，上身效果超赞,2016-09-28 14:22:49,3,0
356060330,颜色分类:010黑;尺码:155/76A/XS,a***8,287796645832,还可以，等老婆回来试试,2016-10-13 08:35:01,2,0
356060330,颜色分类:010黑;尺码:160/80A/S,张***1,283817879578,刚收到就试了一下，感觉大了，但是袖口刚好，拍小一号的话袖子就紧了。整体效果还是很好,2016-09-01 20:54:00,3,1
356060330,颜色分类:043军绿;尺码:160/80A/S,情***2,287427253853,穿上一般吧，显肩宽,2016-10-09 17:45:58,2,0
356060330,颜色分类:010黑;尺码:165/84A/M,w***0,287713640893,好看，不过是宽松版,2016-10-12 06:41:16,3,0
356060330,颜色分类:010黑;尺码:170/88A/L,明***b,288315681097,还可以，大小合适,2016-10-15 19:51:25,3,0
356060330,颜色分类:010黑;尺码:165/84A/M,张***8,288514740615,挺宽松的，我162  112斤，我感觉也许s也可以,2016-10-17 21:45:51,2,0
356060330,颜色分类:010黑;尺码:170/88A/L,毛***虚,288354915942,衣服很合适，质量也不错，好评,2016-10-15 15:22:34,0,0
356060330,颜色分类:043军绿;尺码:160/80A/S,n***2,287917628310,样子好看，显瘦,2016-10-13 20:44:45,4,0
356060330,颜色分类:010黑;尺码:165/84A/M,刘***8,286393029410,好看 效果超好,2016-09-29 09:58:52,3,0
356060330,颜色分类:010黑;尺码:155/76A/XS,宝***屁,284337194291,挺好的，买的最小号，刚好合适，^_^已经洗了有点掉色，然后宿舍没有醋啊，就只用了金纺，希望能保护好点,2016-09-06 09:43:37,2,0
356060330,颜色分类:010黑;尺码:170/88A/L,a***9,287831874793,质量不好。价格还贵&hellip;&hellip;,2016-10-13 07:58:14,2,0
356060330,颜色分类:010黑;尺码:165/84A/M,潘***琳,286244080116,感觉颜色有点旧，洗了再看一下,2016-09-24 12:46:31,4,0
356060330,颜色分类:043军绿;尺码:160/80A/S,小***2,285286644765,有点厚，不知道洗了会不会变形！,2016-09-17 12:03:25,3,0
356060330,颜色分类:043军绿;尺码:175/92A/XL,大***3,284554421605,不错，厚实，袖子紧点,2016-09-11 11:42:04,4,0
356060330,颜色分类:010黑;尺码:160/80A/S,c***9,284953053300,穿上身真的很不错、料子也不错、喜欢！,2016-09-12 13:03:07,0,0
356060330,颜色分类:010黑;尺码:160/80A/S,白***4,287438199501,不错，很满意的一次购物！包装很精致，又是盒子又是袋子的，跟实体店一样,2016-10-07 22:49:17,0,0
356060330,颜色分类:010黑;尺码:165/84A/M,家***1,293692595067,没有想象的那么好看，一般吧，大家都说还行就留下了，双十一249元，过了双十一249.5元，问客服很生硬的回答，怎么了，有问题吗？店家卖多少钱是你们自己的事情，只是拿5毛钱说事欺骗顾客似乎不太好,2016-11-30 10:15:56,4,0
356060330,颜色分类:010黑;尺码:155/76A/XS,瑜***姐,286438672425,款式不错，但是感觉不值这个价。买过的人心里明白。,2016-09-26 22:26:53,3,0
356060330,颜色分类:010黑;尺码:155/76A/XS,a***1,286564827279,衣服上面好多毛，质量还可以，不知道会不会很粘毛,2016-09-30 09:53:01,3,0
356060330,颜色分类:010黑;尺码:170/88A/L,王***9,286572465153,建议买小一码 我买的平时码 简直太肥了 就当休闲穿吧,2016-09-29 11:33:11,3,0
356060330,颜色分类:010黑;尺码:160/80A/S,y***9,285454884204,颜色不是很黑，质量看了一般。洗后穿了再看吧,2016-09-18 13:04:18,2,0
356060330,颜色分类:010黑;尺码:175/92A/XL,t***3,284511887399,衣服收到了，质量很好，就是袖子那儿有点紧,2016-09-10 14:50:29,3,0
356060330,颜色分类:010黑;尺码:155/76A/XS,非***7,286642545656,款式不错、虽然材质不咋地，就是个线织的。穿个款式吧,2016-09-30 23:03:18,3,0
356060330,颜色分类:010黑;尺码:160/80A/S,z***8,286673844595,手感不错，有一点掉毛。,2016-09-30 15:05:28,3,0
356060330,颜色分类:010黑;尺码:155/76A/XS,香***氧,285901688690,将就用，质量不是很好，也不是很差，跟价格匹配,2016-09-24 13:56:44,0,0
356060330,颜色分类:010黑;尺码:160/80A/S,小***1,286232480429,衣服挺好，袖子有点紧，其他都好,2016-09-24 22:20:36,4,0
356060330,颜色分类:010黑;尺码:170/88A/L,火***华,285373494235,衣服质量真差，不值200多，看着像地摊货,2016-09-20 12:04:03,0,0
356060330,颜色分类:010黑;尺码:155/76A/XS,w***0,285576751646,建议选小一码，又大又长，颜色也发暗，不过挺显瘦的,2016-09-22 09:06:13,0,0
356060330,颜色分类:010黑;尺码:175/92A/XL,爱***9,283994009554,号买大了，偏厚，适合冬天打底穿,2016-09-06 14:26:51,4,0
356060330,颜色分类:010黑;尺码:170/88A/L,邹***y,287147382565,这个配长筒靴，美美嗒！适合个高肤白的女生，个儿矮了，会显胖,2016-10-03 12:28:22,3,0
356060330,颜色分类:010黑;尺码:165/84A/M,李***p,287088439142,这毛衣一直让我有种穿反了的感觉，前边领子割脖子,2016-10-03 17:31:12,4,0
356060330,颜色分类:010黑;尺码:165/84A/M,r***1,285133935342,可能是我个子矮 穿着差一点就到膝盖了???165，,2016-09-16 19:59:38,0,0
356060330,颜色分类:010黑;尺码:160/80A/S,m***1,287119152178,很好，就是袖子有点紧,2016-10-03 06:15:53,0,0
356060330,颜色分类:010黑;尺码:175/92A/XL,冰***絮,286824831185,冬天打底穿很好，,2016-10-03 14:48:00,4,0
356060330,颜色分类:010黑;尺码:165/84A/M,珊***5,286425635996,很好看，价位也不贵,2016-09-26 23:14:42,0,0
356060330,颜色分类:010黑;尺码:155/76A/XS,t***7,286752066919,上身试穿了一下，都能穿，好评！,2016-10-03 11:28:01,3,0
356060330,颜色分类:010黑;尺码:165/84A/M,f***7,287168270746,穿上很好看,2016-10-06 09:48:27,3,0
356060330,颜色分类:010黑;尺码:170/88A/L,t***0,288813431072,宝贝很好，穿起来也挺漂亮的,2016-10-19 14:03:49,3,0
356060330,颜色分类:043军绿;尺码:170/88A/L,w***1,288117386385,是他家老顾客啦 一直很喜欢,2016-10-13 12:39:37,3,0
356060330,颜色分类:010黑;尺码:155/76A/XS,阿***q,287553932339,袖子比较紧,2016-10-10 15:35:07,3,0
356060330,颜色分类:043军绿;尺码:175/92A/XL,不***8,286666569445,手袖确实小,2016-10-02 22:08:40,3,0
356060330,颜色分类:010黑;尺码:165/84A/M,z***8,288077177817,衣服不错,2016-10-12 13:17:30,3,0
356060330,颜色分类:010黑;尺码:160/80A/S,果***0,286258661732,袖子有的紧,2016-09-27 16:03:57,0,0
356060330,颜色分类:010黑;尺码:160/80A/S,d***1,286031087396,还可以。买了2件仓库分开发货的，这件不是顺风到的。,2016-09-25 14:02:16,4,0
356060330,颜色分类:010黑;尺码:165/84A/M,小***1,285763049181,还可以，挺满意的,2016-09-23 09:59:51,2,0
356060330,颜色分类:043军绿;尺码:160/80A/S,吉***6,284676094872,本来都做好了不合适退货的打算了，没想到这件衣服特别合适，穿着也漂亮，真心好评。,2016-09-11 22:14:45,2,0
356060330,颜色分类:010黑;尺码:170/88A/L,b***y,284428019333,掉毛现象很严重，还没穿，不知道洗了以后还会不会掉了！款式很喜欢，平时穿的码就行！,2016-09-06 11:28:42,4,0
356060330,颜色分类:010黑;尺码:170/88A/L,r***n,287650633883,还不错，挺好的,2016-10-08 14:20:41,4,0
356060330,颜色分类:010黑;尺码:170/88A/L,琉***儿,288285527802,还行，挺好看,2016-10-15 21:24:36,2,0
356060330,颜色分类:010黑;尺码:170/88A/L,f***p,286675406641,好，很宽松,2016-10-01 13:11:20,0,0
356060330,颜色分类:010黑;尺码:155/76A/XS,t***1,287472307830,一般吧&hellip;&hellip;,2016-10-07 12:31:06,3,0
356060330,颜色分类:010黑;尺码:160/80A/S,t***4,288065304455,超级喜欢！一如既往的好看！,2016-10-14 17:56:25,3,0
356060330,颜色分类:043军绿;尺码:170/88A/L,爱***孓,288119441700,不错，挺好的，168，60kg，要170的，不能买小,2016-10-15 00:03:41,4,0
356060330,颜色分类:010黑;尺码:175/92A/XL,w***3,285940936128,衣服很时尚,2016-09-23 18:02:44,3,0
356060330,颜色分类:010黑;尺码:160/80A/S,w***泪,288414772127,可以等天再冷点穿,2016-10-16 13:36:59,3,0
356060330,颜色分类:010黑;尺码:170/88A/L,i***8,288073291958,还没穿，看上去不错,2016-10-15 09:44:53,4,0
356060330,颜色分类:010黑;尺码:165/84A/M,2***璃,288085726710,宽松版型的很适合我，满意,2016-10-14 15:39:07,3,0
356060330,颜色分类:010黑;尺码:155/76A/XS,a***4,286773420243,简单好搭，only粉丝,2016-10-03 14:22:45,0,0
356060330,颜色分类:010黑;尺码:160/80A/S,l***想,287436654842,喜欢，穿着感觉很好,2016-10-08 22:14:44,3,0
356060330,颜色分类:010黑;尺码:160/80A/S,z***7,283581787726,还不错呀，回来就过了水，有些轻微的掉色属于正常的，袖子有点窄手臂粗的人会有点紧。,2016-08-31 11:21:26,3,0
356060330,颜色分类:010黑;尺码:160/80A/S,观***风,288257045535,可以的&hellip;&hellip;很洋气,2016-10-16 20:59:47,2,0
356060330,颜色分类:010黑;尺码:160/80A/S,t***0,285001211972,袖子什么刚刚好，有点味道。希望洗了就好了。刚刚打开毛衣，衣服上有一些小棉球。拿了。。。说明衣服会黏毛。不过毛衣都会把！,2016-09-15 16:39:55,0,0
356060330,颜色分类:010黑;尺码:160/80A/S,甜***5,288804039286,正品，衣服很满意,2016-10-19 16:03:28,0,0
